3/7/2022,7/15/2022,TRUE,726.37,glaws70@liveinternet.ru,cfudger70@census.gov,Panasonic,Other,LED,3,"Phasellus id sapien in sapien iaculis congue. Vivamus metus arcu, adipiscing molestie, hendrerit at, vulputate vitae, nisl.",253
3/11/2022,12/18/2022,TRUE,940.56,dhuie71@furl.net,nsayburn71@berkeley.edu,Panasonic,Other,LED,1,Aenean lectus. Pellentesque eget nunc. Donec quis orci eget orci vehicula condimentum. Curabitur in libero ut massa volutpat convallis.,254
3/11/2022,11/17/2022,FALSE,9.86,rtantum72@qq.com,eduley72@flavors.me,LG,Display,LCD,5,"Pellentesque ultrices mattis odio. Donec vitae nisi. Nam ultrices, libero non mattis pulvinar, nulla pede ullamcorper augue, a suscipit nulla elit ac nulla. Sed vel enim sit amet nunc viverra dapibus. Nulla suscipit ligula in lacus. Curabitur at ipsum ac tellus semper interdum.",255
3/11/2022,11/29/2022,FALSE,15.66,bimlock73@ning.com,wadanez73@accuweather.com,Samsung,Display,LCD,4,Aenean auctor gravida sem. Praesent id massa id nisl venenatis lacinia. Aenean sit amet justo. Morbi ut odio.,256
3/11/2022,8/25/2022,TRUE,704.36,hbhar74@wp.com,epender74@wordpress.com,Panasonic,Power,LCD,5,Vivamus tortor. Duis mattis egestas metus. Aenean fermentum. Donec ut mauris eget massa tempor convallis.,257
3/11/2022,4/3/2023,TRUE,455.9,nmatiashvili75@disqus.com,rdrewe75@intel.com,Sony,Display,Speaker,3,"Fusce lacus purus, aliquet at, feugiat non, pretium quis, lectus. Suspendisse potenti.",258
3/11/2022,9/5/2022,FALSE,272.41,fsyversen76@github.io,lbrittan76@multiply.com,Samsung,Display,LCD,2,"Mauris sit amet eros. Suspendisse accumsan tortor quis turpis. Sed ante. Vivamus tortor. Duis mattis egestas metus. Aenean fermentum. Donec ut mauris eget massa tempor convallis. Nulla neque libero, convallis eget, eleifend luctus, ultricies eu, nibh. Quisque id justo sit amet sapien dignissim vestibulum. Vestibulum ante ipsum primis in faucibus orci luctus et ultrices posuere cubilia Curae; Nulla dapibus dolor vel est.",259
3/11/2022,8/23/2022,FALSE,360.58,aritchings77@webs.com,jquinell77@printfriendly.com,Panasonic,Sound,Plasma,5,"Morbi non quam nec dui luctus rutrum. Nulla tellus. In sagittis dui vel nisl. Duis ac nibh. Fusce lacus purus, aliquet at, feugiat non, pretium quis, lectus. Suspendisse potenti.",260
3/11/2022,12/22/2022,FALSE,957.23,cshea78@engadget.com,rseivertsen78@simplemachines.org,Panasonic,Connectivity,LCD,1,"Morbi vel lectus in quam fringilla rhoncus. Mauris enim leo, rhoncus sed, vestibulum sit amet, cursus id, turpis. Integer aliquet, massa id lobortis convallis, tortor risus dapibus augue, vel accumsan tellus nisi eu orci. Mauris lacinia sapien quis libero. Nullam sit amet turpis elementum ligula vehicula consequat. Morbi a ipsum. Integer a nibh.",261
3/8/2022,3/23/2023,TRUE,152.73,bfirk79@sakura.ne.jp,mdavydzenko79@privacy.gov.au,Toshiba,Power,LED,0,Etiam justo. Etiam pretium iaculis justo. In hac habitasse platea dictumst. Etiam faucibus cursus urna.,262
3/15/2022,2/9/2023,FALSE,226.7,blappin7a@mayoclinic.com,fmcewan7a@intel.com,LG,Sound,Plasma,2,"Duis mattis egestas metus. Aenean fermentum. Donec ut mauris eget massa tempor convallis. Nulla neque libero, convallis eget, eleifend luctus, ultricies eu, nibh. Quisque id justo sit amet sapien dignissim vestibulum. Vestibulum ante ipsum primis in faucibus orci luctus et ultrices posuere cubilia Curae; Nulla dapibus dolor vel est. Donec odio justo, sollicitudin ut, suscipit a, feugiat et, eros. Vestibulum ac est lacinia nisi venenatis tristique. Fusce congue, diam id ornare imperdiet, sapien urna pretium nisl, ut volutpat sapien arcu sed augue.",263
3/15/2022,5/29/2023,FALSE,443.84,kbeven7b@economist.com,mchitter7b@desdev.cn,LG,Other,Motherboard,2,"Nulla ac enim. In tempor, turpis nec euismod scelerisque, quam turpis adipiscing lorem, vitae mattis nibh ligula nec sem. Duis aliquam convallis nunc. Proin at turpis a pede posuere nonummy. Integer non velit. Donec diam neque, vestibulum eget, vulputate ut, ultrices vel, augue. Vestibulum ante ipsum primis in faucibus orci luctus et ultrices posuere cubilia Curae; Donec pharetra, magna vestibulum aliquet ultrices, erat tortor sollicitudin mi, sit amet lobortis sapien sapien non mi. Integer ac neque.",264
3/14/2022,6/16/2023,TRUE,589.96,lduddell7c@discovery.com,mparell7c@woothemes.com,Panasonic,Sound,LCD,5,"Nam dui. Proin leo odio, porttitor id, consequat in, consequat ut, nulla. Sed accumsan felis. Ut at dolor quis odio consequat varius. Integer ac leo. Pellentesque ultrices mattis odio. Donec vitae nisi. Nam ultrices, libero non mattis pulvinar, nulla pede ullamcorper augue, a suscipit nulla elit ac nulla. Sed vel enim sit amet nunc viverra dapibus.",265
3/14/2022,3/28/2023,TRUE,497.31,skester7d@blogspot.com,hgrundle7d@delicious.com,LG,Other,Motherboard,2,"Aliquam sit amet diam in magna bibendum imperdiet. Nullam orci pede, venenatis non, sodales sed, tincidunt eu, felis.",266
3/14/2022,3/1/2023,FALSE,996.92,nmoyle7e@sogou.com,llatore7e@dagondesign.com,LG,Display,Plasma,1,Morbi non lectus. Aliquam sit amet diam in magna bibendum imperdiet.,267
3/14/2022,9/8/2022,TRUE,721.68,sbaumert7f@amazon.com,kgolston7f@imdb.com,Toshiba,Connectivity,Plasma,4,Fusce consequat. Nulla nisl.,268
3/10/2022,4/29/2023,FALSE,155.48,wbarlow7g@google.co.uk,rravel7g@dagondesign.com,Toshiba,Connectivity,LCD,5,Curabitur at ipsum ac tellus semper interdum. Mauris ullamcorper purus sit amet nulla.,269
3/10/2022,1/11/2023,TRUE,708.23,sfirminger7h@bluehost.com,mjamme7h@hud.gov,LG,Other,Plasma,1,Maecenas ut massa quis augue luctus tincidunt. Nulla mollis molestie lorem.,270
3/10/2022,9/11/2022,FALSE,602.52,xdocharty7i@constantcontact.com,streher7i@qq.com,Panasonic,Connectivity,Speaker,2,Aenean sit amet justo.,271
3/10/2022,6/22/2023,TRUE,873.39,aspat7j@stanford.edu,hhalpin7j@google.com.br,Samsung,Other,LCD,2,"Morbi sem mauris, laoreet ut, rhoncus aliquet, pulvinar sed, nisl. Nunc rhoncus dui vel sem. Sed sagittis. Nam congue, risus semper porta volutpat, quam pede lobortis ligula, sit amet eleifend pede libero quis orci. Nullam molestie nibh in lectus. Pellentesque at nulla. Suspendisse potenti. Cras in purus eu magna vulputate luctus. Cum sociis natoque penatibus et magnis dis parturient montes, nascetur ridiculus mus. Vivamus vestibulum sagittis sapien.",272
3/10/2022,5/8/2023,FALSE,754.62,rfedoronko7k@comsenz.com,bpatis7k@163.com,Panasonic,Sound,LCD,4,Donec semper sapien a libero.,273
3/10/2022,2/4/2023,TRUE,722.15,jconstant7l@hp.com,dtailby7l@deviantart.com,Panasonic,Power,Plasma,0,"Nulla neque libero, convallis eget, eleifend luctus, ultricies eu, nibh. Quisque id justo sit amet sapien dignissim vestibulum. Vestibulum ante ipsum primis in faucibus orci luctus et ultrices posuere cubilia Curae; Nulla dapibus dolor vel est.",274
3/10/2022,5/5/2023,FALSE,985.29,bkwiek7m@independent.co.uk,gkearford7m@redcross.org,Sony,Display,Speaker,4,"Nulla ac enim. In tempor, turpis nec euismod scelerisque, quam turpis adipiscing lorem, vitae mattis nibh ligula nec sem. Duis aliquam convallis nunc. Proin at turpis a pede posuere nonummy. Integer non velit. Donec diam neque, vestibulum eget, vulputate ut, ultrices vel, augue. Vestibulum ante ipsum primis in faucibus orci luctus et ultrices posuere cubilia Curae; Donec pharetra, magna vestibulum aliquet ultrices, erat tortor sollicitudin mi, sit amet lobortis sapien sapien non mi.",275
3/10/2022,1/20/2023,FALSE,707.17,ebafford7n@tiny.cc,tdielhenn7n@netvibes.com,LG,Display,LCD,4,"Vestibulum rutrum rutrum neque. Aenean auctor gravida sem. Praesent id massa id nisl venenatis lacinia. Aenean sit amet justo. Morbi ut odio. Cras mi pede, malesuada in, imperdiet et, commodo vulputate, justo.",276
3/10/2022,10/10/2022,TRUE,228.18,jcocklie7o@arizona.edu,npumfrett7o@dropbox.com,Panasonic,Sound,Speaker,5,"Quisque porta volutpat erat. Quisque erat eros, viverra eget, congue eget, semper rutrum, nulla. Nunc purus. Phasellus in felis.",277
3/5/2022,2/26/2023,TRUE,247.68,elamplugh7p@example.com,nthews7p@cocolog-nifty.com,Sony,Connectivity,LCD,4,"Quisque ut erat. Curabitur gravida nisi at nibh. In hac habitasse platea dictumst. Aliquam augue quam, sollicitudin vitae, consectetuer eget, rutrum at, lorem. Integer tincidunt ante vel ipsum. Praesent blandit lacinia erat. Vestibulum sed magna at nunc commodo placerat.",278
3/5/2022,6/21/2023,FALSE,347.65,fondrousek7q@yelp.com,kbaseley7q@booking.com,Panasonic,Display,Plasma,3,"Donec semper sapien a libero. Nam dui. Proin leo odio, porttitor id, consequat in, consequat ut, nulla. Sed accumsan felis. Ut at dolor quis odio consequat varius. Integer ac leo. Pellentesque ultrices mattis odio.",279
3/5/2022,7/7/2022,TRUE,494.99,rrourke7r@opera.com,isailor7r@wikia.com,Panasonic,Connectivity,LCD,5,"Pellentesque ultrices mattis odio. Donec vitae nisi. Nam ultrices, libero non mattis pulvinar, nulla pede ullamcorper augue, a suscipit nulla elit ac nulla. Sed vel enim sit amet nunc viverra dapibus. Nulla suscipit ligula in lacus. Curabitur at ipsum ac tellus semper interdum. Mauris ullamcorper purus sit amet nulla. Quisque arcu libero, rutrum ac, lobortis vel, dapibus at, diam. Nam tristique tortor eu pede.",280
3/5/2022,10/19/2022,TRUE,447.76,gbaseke7s@mapquest.com,lniesing7s@netlog.com,Sony,Sound,Motherboard,3,"Nulla tempus. Vivamus in felis eu sapien cursus vestibulum. Proin eu mi. Nulla ac enim. In tempor, turpis nec euismod scelerisque, quam turpis adipiscing lorem, vitae mattis nibh ligula nec sem. Duis aliquam convallis nunc. Proin at turpis a pede posuere nonummy. Integer non velit. Donec diam neque, vestibulum eget, vulputate ut, ultrices vel, augue. Vestibulum ante ipsum primis in faucibus orci luctus et ultrices posuere cubilia Curae; Donec pharetra, magna vestibulum aliquet ultrices, erat tortor sollicitudin mi, sit amet lobortis sapien sapien non mi.",281
3/5/2022,11/18/2022,FALSE,100.14,mmargeram7t@marriott.com,rclarycott7t@tinypic.com,Samsung,Connectivity,Plasma,2,Etiam faucibus cursus urna. Ut tellus. Nulla ut erat id mauris vulputate elementum. Nullam varius. Nulla facilisi. Cras non velit nec nisi vulputate nonummy. Maecenas tincidunt lacus at velit.,282
3/5/2022,1/3/2023,TRUE,512.28,rlister7u@gravatar.com,khalbard7u@noaa.gov,Samsung,Other,Motherboard,1,In congue. Etiam justo. Etiam pretium iaculis justo.,283
3/5/2022,7/6/2022,FALSE,189.86,dwhitely7v@mayoclinic.com,mzaniolini7v@blinklist.com,Sony,Display,LED,0,"Proin leo odio, porttitor id, consequat in, consequat ut, nulla. Sed accumsan felis. Ut at dolor quis odio consequat varius.",284
3/5/2022,6/22/2023,FALSE,973.92,dhulance7w@archive.org,rklesse7w@51.la,LG,Connectivity,LED,2,"Nulla suscipit ligula in lacus. Curabitur at ipsum ac tellus semper interdum. Mauris ullamcorper purus sit amet nulla. Quisque arcu libero, rutrum ac, lobortis vel, dapibus at, diam.",285
3/5/2022,4/8/2023,FALSE,351,eeubank7x@opensource.org,osimonetto7x@tmall.com,LG,Other,Plasma,4,Nullam sit amet turpis elementum ligula vehicula consequat. Morbi a ipsum.,286
3/5/2022,11/6/2022,TRUE,340.5,ashoebridge7y@springer.com,mmulvin7y@nymag.com,Sony,Power,LED,1,"Phasellus sit amet erat. Nulla tempus. Vivamus in felis eu sapien cursus vestibulum. Proin eu mi. Nulla ac enim. In tempor, turpis nec euismod scelerisque, quam turpis adipiscing lorem, vitae mattis nibh ligula nec sem. Duis aliquam convallis nunc. Proin at turpis a pede posuere nonummy. Integer non velit. Donec diam neque, vestibulum eget, vulputate ut, ultrices vel, augue.",287
3/5/2022,5/30/2023,TRUE,509,tmaskall7z@newyorker.com,asink7z@odnoklassniki.ru,Panasonic,Connectivity,LCD,4,"Suspendisse ornare consequat lectus. In est risus, auctor sed, tristique in, tempus sit amet, sem. Fusce consequat.",288
3/5/2022,10/3/2022,FALSE,511.99,apawden80@nasa.gov,limort80@eventbrite.com,Toshiba,Sound,Plasma,4,Mauris sit amet eros. Suspendisse accumsan tortor quis turpis. Sed ante.,289
3/6/2022,6/4/2023,TRUE,617.16,slysaght81@imgur.com,llace81@last.fm,LG,Sound,LED,1,"Duis at velit eu est congue elementum. In hac habitasse platea dictumst. Morbi vestibulum, velit id pretium iaculis, diam erat fermentum justo, nec condimentum neque sapien placerat ante.",290
3/5/2022,9/28/2022,FALSE,146.87,aclemendot82@google.cn,tmurricanes82@addtoany.com,Samsung,Connectivity,Plasma,4,"In hac habitasse platea dictumst. Aliquam augue quam, sollicitudin vitae, consectetuer eget, rutrum at, lorem. Integer tincidunt ante vel ipsum. Praesent blandit lacinia erat. Vestibulum sed magna at nunc commodo placerat. Praesent blandit.",291
3/5/2022,11/16/2022,TRUE,743.12,wrouzet83@auda.org.au,wainsley83@networkadvertising.org,LG,Sound,LCD,1,"Duis bibendum, felis sed interdum venenatis, turpis enim blandit mi, in porttitor pede justo eu massa. Donec dapibus.",292
3/5/2022,10/17/2022,TRUE,996.59,fcleaton84@wordpress.com,srogerson84@nba.com,Toshiba,Display,Plasma,0,Suspendisse potenti. Nullam porttitor lacus at turpis. Donec posuere metus vitae ipsum.,293
3/5/2022,3/6/2023,TRUE,882.59,dgibbeson85@theguardian.com,fhaack85@vk.com,Toshiba,Display,Speaker,2,"In hac habitasse platea dictumst. Morbi vestibulum, velit id pretium iaculis, diam erat fermentum justo, nec condimentum neque sapien placerat ante. Nulla justo. Aliquam quis turpis eget elit sodales scelerisque. Mauris sit amet eros. Suspendisse accumsan tortor quis turpis. Sed ante. Vivamus tortor. Duis mattis egestas metus.",294
3/4/2022,11/7/2022,TRUE,460.62,jhammerson86@tripadvisor.com,mhovell86@phoca.cz,Samsung,Other,Speaker,3,"Vivamus vestibulum sagittis sapien. Cum sociis natoque penatibus et magnis dis parturient montes, nascetur ridiculus mus. Etiam vel augue. Vestibulum rutrum rutrum neque. Aenean auctor gravida sem. Praesent id massa id nisl venenatis lacinia. Aenean sit amet justo. Morbi ut odio. Cras mi pede, malesuada in, imperdiet et, commodo vulputate, justo.",295
3/4/2022,11/22/2022,TRUE,669.68,fcastelletto87@marketwatch.com,aprescote87@harvard.edu,Samsung,Sound,LCD,5,"Curabitur convallis. Duis consequat dui nec nisi volutpat eleifend. Donec ut dolor. Morbi vel lectus in quam fringilla rhoncus. Mauris enim leo, rhoncus sed, vestibulum sit amet, cursus id, turpis. Integer aliquet, massa id lobortis convallis, tortor risus dapibus augue, vel accumsan tellus nisi eu orci. Mauris lacinia sapien quis libero. Nullam sit amet turpis elementum ligula vehicula consequat.",296
3/4/2022,11/5/2022,FALSE,504.7,ndagnan88@oakley.com,hstrafen88@over-blog.com,Sony,Power,Motherboard,1,"Morbi non lectus. Aliquam sit amet diam in magna bibendum imperdiet. Nullam orci pede, venenatis non, sodales sed, tincidunt eu, felis. Fusce posuere felis sed lacus. Morbi sem mauris, laoreet ut, rhoncus aliquet, pulvinar sed, nisl. Nunc rhoncus dui vel sem. Sed sagittis. Nam congue, risus semper porta volutpat, quam pede lobortis ligula, sit amet eleifend pede libero quis orci. Nullam molestie nibh in lectus. Pellentesque at nulla.",297
3/4/2022,4/19/2023,TRUE,121.47,adyte89@princeton.edu,grawet89@lycos.com,Toshiba,Other,Motherboard,2,"Donec ut mauris eget massa tempor convallis. Nulla neque libero, convallis eget, eleifend luctus, ultricies eu, nibh. Quisque id justo sit amet sapien dignissim vestibulum. Vestibulum ante ipsum primis in faucibus orci luctus et ultrices posuere cubilia Curae; Nulla dapibus dolor vel est. Donec odio justo, sollicitudin ut, suscipit a, feugiat et, eros. Vestibulum ac est lacinia nisi venenatis tristique. Fusce congue, diam id ornare imperdiet, sapien urna pretium nisl, ut volutpat sapien arcu sed augue. Aliquam erat volutpat. In congue.",298
3/4/2022,2/12/2023,TRUE,644.34,vwitcomb8a@360.cn,erapkins8a@ocn.ne.jp,Samsung,Connectivity,Speaker,3,In sagittis dui vel nisl. Duis ac nibh.,299
3/5/2022,6/3/2023,TRUE,396.16,wbenyan8b@vinaora.com,jvalois8b@princeton.edu,Panasonic,Power,LCD,4,"Nullam molestie nibh in lectus. Pellentesque at nulla. Suspendisse potenti. Cras in purus eu magna vulputate luctus. Cum sociis natoque penatibus et magnis dis parturient montes, nascetur ridiculus mus. Vivamus vestibulum sagittis sapien. Cum sociis natoque penatibus et magnis dis parturient montes, nascetur ridiculus mus. Etiam vel augue. Vestibulum rutrum rutrum neque.",300
3/5/2022,1/3/2023,TRUE,804.24,dkhan8c@sciencedirect.com,pbehagg8c@xing.com,Toshiba,Connectivity,Speaker,4,"Nunc rhoncus dui vel sem. Sed sagittis. Nam congue, risus semper porta volutpat, quam pede lobortis ligula, sit amet eleifend pede libero quis orci. Nullam molestie nibh in lectus. Pellentesque at nulla. Suspendisse potenti.",301
3/5/2022,2/24/2023,TRUE,635.12,dturbat8d@unesco.org,jgonsalvez8d@constantcontact.com,Sony,Power,Speaker,3,"Vestibulum quam sapien, varius ut, blandit non, interdum in, ante. Vestibulum ante ipsum primis in faucibus orci luctus et ultrices posuere cubilia Curae; Duis faucibus accumsan odio. Curabitur convallis.",302
3/5/2022,4/5/2023,FALSE,79.37,darkley8e@ycombinator.com,aleadbeatter8e@nytimes.com,Sony,Connectivity,Motherboard,4,Nulla justo. Aliquam quis turpis eget elit sodales scelerisque. Mauris sit amet eros. Suspendisse accumsan tortor quis turpis. Sed ante.,303
3/5/2022,6/18/2023,TRUE,51.1,ekelwaybamber8f@bigcartel.com,tmccambridge8f@wordpress.com,Sony,Sound,Motherboard,1,"Nullam molestie nibh in lectus. Pellentesque at nulla. Suspendisse potenti. Cras in purus eu magna vulputate luctus. Cum sociis natoque penatibus et magnis dis parturient montes, nascetur ridiculus mus. Vivamus vestibulum sagittis sapien.",304
3/5/2022,6/17/2023,TRUE,541.05,miley8g@alibaba.com,dcastiglioni8g@oracle.com,Panasonic,Other,Motherboard,2,"Cum sociis natoque penatibus et magnis dis parturient montes, nascetur ridiculus mus. Vivamus vestibulum sagittis sapien.",305
3/5/2022,6/16/2023,TRUE,54.46,tmatuszak8h@hubpages.com,gtripney8h@csmonitor.com,LG,Display,Plasma,4,Mauris lacinia sapien quis libero. Nullam sit amet turpis elementum ligula vehicula consequat. Morbi a ipsum. Integer a nibh. In quis justo. Maecenas rhoncus aliquam lacus.,306
3/5/2022,8/24/2022,TRUE,219.75,mcasemore8i@networksolutions.com,hkerner8i@uol.com.br,Samsung,Connectivity,LCD,1,"Nulla facilisi. Cras non velit nec nisi vulputate nonummy. Maecenas tincidunt lacus at velit. Vivamus vel nulla eget eros elementum pellentesque. Quisque porta volutpat erat. Quisque erat eros, viverra eget, congue eget, semper rutrum, nulla. Nunc purus. Phasellus in felis.",307
3/4/2022,10/14/2022,FALSE,116.14,crheaume8j@patch.com,bgoldsbury8j@bandcamp.com,Samsung,Sound,Speaker,5,"Fusce consequat. Nulla nisl. Nunc nisl. Duis bibendum, felis sed interdum venenatis, turpis enim blandit mi, in porttitor pede justo eu massa. Donec dapibus. Duis at velit eu est congue elementum. In hac habitasse platea dictumst. Morbi vestibulum, velit id pretium iaculis, diam erat fermentum justo, nec condimentum neque sapien placerat ante.",308
3/4/2022,3/22/2023,TRUE,258.05,ctatlow8k@bing.com,ebetterton8k@amazon.co.jp,Toshiba,Connectivity,Motherboard,1,Ut tellus. Nulla ut erat id mauris vulputate elementum. Nullam varius. Nulla facilisi.,309
3/4/2022,6/8/2023,FALSE,882.36,vgiddy8l@de.vu,gchastan8l@thetimes.co.uk,Toshiba,Sound,LCD,3,"Cum sociis natoque penatibus et magnis dis parturient montes, nascetur ridiculus mus. Vivamus vestibulum sagittis sapien. Cum sociis natoque penatibus et magnis dis parturient montes, nascetur ridiculus mus. Etiam vel augue. Vestibulum rutrum rutrum neque.",310
3/4/2022,1/10/2023,FALSE,123.28,jroyan8m@topsy.com,ttolemache8m@apache.org,Samsung,Sound,Speaker,2,"Vestibulum sed magna at nunc commodo placerat. Praesent blandit. Nam nulla. Integer pede justo, lacinia eget, tincidunt eget, tempus vel, pede. Morbi porttitor lorem id ligula. Suspendisse ornare consequat lectus. In est risus, auctor sed, tristique in, tempus sit amet, sem.",311
3/4/2022,8/28/2022,FALSE,607.8,mhedde8n@tripod.com,mschmuhl8n@cbsnews.com,Toshiba,Connectivity,Speaker,3,Morbi non quam nec dui luctus rutrum. Nulla tellus. In sagittis dui vel nisl.,312
3/4/2022,12/20/2022,FALSE,230.06,ljoicey8o@npr.org,ahulls8o@earthlink.net,Sony,Display,Motherboard,3,"Mauris sit amet eros. Suspendisse accumsan tortor quis turpis. Sed ante. Vivamus tortor. Duis mattis egestas metus. Aenean fermentum. Donec ut mauris eget massa tempor convallis. Nulla neque libero, convallis eget, eleifend luctus, ultricies eu, nibh. Quisque id justo sit amet sapien dignissim vestibulum.",313
3/5/2022,7/22/2022,TRUE,763.68,ahaydon8p@devhub.com,bwoodham8p@surveymonkey.com,Sony,Other,Speaker,0,"Integer non velit. Donec diam neque, vestibulum eget, vulputate ut, ultrices vel, augue. Vestibulum ante ipsum primis in faucibus orci luctus et ultrices posuere cubilia Curae; Donec pharetra, magna vestibulum aliquet ultrices, erat tortor sollicitudin mi, sit amet lobortis sapien sapien non mi. Integer ac neque. Duis bibendum. Morbi non quam nec dui luctus rutrum. Nulla tellus. In sagittis dui vel nisl.",314
3/4/2022,6/1/2023,TRUE,803.79,bhyett8q@cdc.gov,gbelderfield8q@techcrunch.com,LG,Sound,Speaker,3,Duis bibendum. Morbi non quam nec dui luctus rutrum. Nulla tellus.,315
3/5/2022,10/11/2022,FALSE,81.76,ctrewhella8r@yelp.com,mbruhn8r@tinypic.com,Sony,Power,LED,2,Suspendisse potenti. Nullam porttitor lacus at turpis. Donec posuere metus vitae ipsum. Aliquam non mauris. Morbi non lectus. Aliquam sit amet diam in magna bibendum imperdiet.,316
3/5/2022,12/26/2022,TRUE,222.33,ademicoli8s@livejournal.com,dsansbury8s@plala.or.jp,Samsung,Sound,Motherboard,0,"Pellentesque ultrices mattis odio. Donec vitae nisi. Nam ultrices, libero non mattis pulvinar, nulla pede ullamcorper augue, a suscipit nulla elit ac nulla. Sed vel enim sit amet nunc viverra dapibus. Nulla suscipit ligula in lacus. Curabitur at ipsum ac tellus semper interdum. Mauris ullamcorper purus sit amet nulla. Quisque arcu libero, rutrum ac, lobortis vel, dapibus at, diam.",317
3/5/2022,2/19/2023,FALSE,221.03,ecauley8t@naver.com,cbuttwell8t@howstuffworks.com,Panasonic,Power,LED,0,"Mauris lacinia sapien quis libero. Nullam sit amet turpis elementum ligula vehicula consequat. Morbi a ipsum. Integer a nibh. In quis justo. Maecenas rhoncus aliquam lacus. Morbi quis tortor id nulla ultrices aliquet. Maecenas leo odio, condimentum id, luctus nec, molestie sed, justo. Pellentesque viverra pede ac diam. Cras pellentesque volutpat dui.",318
3/5/2022,5/26/2023,FALSE,842.41,dbrave8u@mapy.cz,bsclanders8u@mediafire.com,Sony,Display,Motherboard,5,Integer ac neque. Duis bibendum. Morbi non quam nec dui luctus rutrum. Nulla tellus.,319
3/5/2022,6/24/2022,FALSE,759.66,xporteous8v@shareasale.com,mmcginley8v@wufoo.com,Panasonic,Sound,LCD,1,"Maecenas tincidunt lacus at velit. Vivamus vel nulla eget eros elementum pellentesque. Quisque porta volutpat erat. Quisque erat eros, viverra eget, congue eget, semper rutrum, nulla. Nunc purus. Phasellus in felis.",320
3/5/2022,12/20/2022,TRUE,799.97,mcullingford8w@clickbank.net,jlippi8w@hexun.com,Toshiba,Display,LED,4,"In hac habitasse platea dictumst. Maecenas ut massa quis augue luctus tincidunt. Nulla mollis molestie lorem. Quisque ut erat. Curabitur gravida nisi at nibh. In hac habitasse platea dictumst. Aliquam augue quam, sollicitudin vitae, consectetuer eget, rutrum at, lorem. Integer tincidunt ante vel ipsum. Praesent blandit lacinia erat. Vestibulum sed magna at nunc commodo placerat.",321
3/5/2022,9/28/2022,TRUE,673.78,fsummerson8x@sphinn.com,acussen8x@360.cn,Panasonic,Other,Motherboard,5,"In blandit ultrices enim. Lorem ipsum dolor sit amet, consectetuer adipiscing elit. Proin interdum mauris non ligula pellentesque ultrices.",322
3/5/2022,6/4/2023,FALSE,657.89,sstokey8y@odnoklassniki.ru,dhindrich8y@cbslocal.com,Samsung,Sound,LED,5,"Morbi vestibulum, velit id pretium iaculis, diam erat fermentum justo, nec condimentum neque sapien placerat ante. Nulla justo. Aliquam quis turpis eget elit sodales scelerisque. Mauris sit amet eros. Suspendisse accumsan tortor quis turpis. Sed ante.",323
3/8/2022,2/25/2023,FALSE,295.35,demmins8z@wired.com,cdarlison8z@apache.org,LG,Other,Motherboard,2,Donec posuere metus vitae ipsum. Aliquam non mauris.,324
3/8/2022,3/23/2023,TRUE,544.6,rtorns90@slashdot.org,sleaf90@creativecommons.org,Panasonic,Other,Plasma,2,"Nulla tempus. Vivamus in felis eu sapien cursus vestibulum. Proin eu mi. Nulla ac enim. In tempor, turpis nec euismod scelerisque, quam turpis adipiscing lorem, vitae mattis nibh ligula nec sem. Duis aliquam convallis nunc.",325
3/8/2022,7/12/2022,TRUE,439.75,dllop91@technorati.com,aphetteplace91@cdc.gov,LG,Connectivity,Plasma,2,"Curabitur in libero ut massa volutpat convallis. Morbi odio odio, elementum eu, interdum eu, tincidunt in, leo.",326
3/8/2022,10/21/2022,FALSE,440.8,ajinda92@google.nl,ogeorg92@techcrunch.com,Toshiba,Connectivity,Motherboard,1,Quisque ut erat. Curabitur gravida nisi at nibh. In hac habitasse platea dictumst.,327
3/8/2022,10/6/2022,FALSE,26.96,egonning93@usgs.gov,aschorah93@multiply.com,Toshiba,Sound,LCD,4,"In sagittis dui vel nisl. Duis ac nibh. Fusce lacus purus, aliquet at, feugiat non, pretium quis, lectus. Suspendisse potenti. In eleifend quam a odio. In hac habitasse platea dictumst. Maecenas ut massa quis augue luctus tincidunt. Nulla mollis molestie lorem.",328
3/7/2022,12/13/2022,TRUE,605.97,eclericoates94@gmpg.org,sfitchett94@bloglovin.com,Sony,Sound,LED,1,"Morbi sem mauris, laoreet ut, rhoncus aliquet, pulvinar sed, nisl. Nunc rhoncus dui vel sem. Sed sagittis.",329
3/7/2022,1/11/2023,TRUE,531.73,zstonier95@loc.gov,hpercifer95@so-net.ne.jp,Samsung,Power,Plasma,5,"Donec odio justo, sollicitudin ut, suscipit a, feugiat et, eros.",330
3/7/2022,7/19/2022,TRUE,527.59,truperti96@merriam-webster.com,esink96@samsung.com,Toshiba,Sound,Motherboard,1,"Integer ac leo. Pellentesque ultrices mattis odio. Donec vitae nisi. Nam ultrices, libero non mattis pulvinar, nulla pede ullamcorper augue, a suscipit nulla elit ac nulla. Sed vel enim sit amet nunc viverra dapibus.",331
