3/4/2022,5/26/2023,TRUE,83.96,dwaddell0@google.es,cpavek0@eventbrite.com,Panasonic,Sound,Speaker,1,"Nulla mollis molestie lorem. Quisque ut erat. Curabitur gravida nisi at nibh. In hac habitasse platea dictumst. Aliquam augue quam, sollicitudin vitae, consectetuer eget, rutrum at, lorem. Integer tincidunt ante vel ipsum. Praesent blandit lacinia erat. Vestibulum sed magna at nunc commodo placerat. Praesent blandit. Nam nulla.",1
3/5/2022,5/3/2023,TRUE,3.26,jmooring1@cdc.gov,rbrymner1@nationalgeographic.com,LG,Power,Motherboard,4,"Mauris enim leo, rhoncus sed, vestibulum sit amet, cursus id, turpis. Integer aliquet, massa id lobortis convallis, tortor risus dapibus augue, vel accumsan tellus nisi eu orci. Mauris lacinia sapien quis libero. Nullam sit amet turpis elementum ligula vehicula consequat. Morbi a ipsum. Integer a nibh. In quis justo. Maecenas rhoncus aliquam lacus. Morbi quis tortor id nulla ultrices aliquet.",2
3/7/2022,3/17/2023,FALSE,753.83,dmaryott2@shareasale.com,rdank2@huffingtonpost.com,Panasonic,Power,Motherboard,0,"Maecenas tristique, est et tempus semper, est quam pharetra magna, ac consequat metus sapien ut nunc. Vestibulum ante ipsum primis in faucibus orci luctus et ultrices posuere cubilia Curae; Mauris viverra diam vitae quam. Suspendisse potenti. Nullam porttitor lacus at turpis. Donec posuere metus vitae ipsum. Aliquam non mauris. Morbi non lectus. Aliquam sit amet diam in magna bibendum imperdiet. Nullam orci pede, venenatis non, sodales sed, tincidunt eu, felis.",3
3/17/2022,6/19/2023,FALSE,517.68,emcian3@cisco.com,ngallardo3@networkadvertising.org,LG,Sound,Speaker,2,Integer tincidunt ante vel ipsum. Praesent blandit lacinia erat. Vestibulum sed magna at nunc commodo placerat. Praesent blandit.,4
3/17/2022,6/26/2022,FALSE,559,amelbourne4@slideshare.net,pbaldini4@blogger.com,Toshiba,Sound,Motherboard,4,"Sed ante. Vivamus tortor. Duis mattis egestas metus. Aenean fermentum. Donec ut mauris eget massa tempor convallis. Nulla neque libero, convallis eget, eleifend luctus, ultricies eu, nibh.",5
3/17/2022,7/29/2022,FALSE,74.78,jdibden5@hubpages.com,lruckert5@archive.org,Samsung,Other,LCD,4,"Donec semper sapien a libero. Nam dui. Proin leo odio, porttitor id, consequat in, consequat ut, nulla. Sed accumsan felis. Ut at dolor quis odio consequat varius. Integer ac leo.",6
3/7/2022,10/12/2022,TRUE,699.95,cyoxen6@state.gov,afrances6@narod.ru,LG,Power,LED,3,"Sed sagittis. Nam congue, risus semper porta volutpat, quam pede lobortis ligula, sit amet eleifend pede libero quis orci. Nullam molestie nibh in lectus. Pellentesque at nulla. Suspendisse potenti. Cras in purus eu magna vulputate luctus. Cum sociis natoque penatibus et magnis dis parturient montes, nascetur ridiculus mus. Vivamus vestibulum sagittis sapien. Cum sociis natoque penatibus et magnis dis parturient montes, nascetur ridiculus mus.",7
3/7/2022,6/3/2023,FALSE,535.12,iacton7@google.nl,eoshiel7@sogou.com,Samsung,Sound,Plasma,0,"Morbi non quam nec dui luctus rutrum. Nulla tellus. In sagittis dui vel nisl. Duis ac nibh. Fusce lacus purus, aliquet at, feugiat non, pretium quis, lectus. Suspendisse potenti.",8
3/7/2022,6/18/2023,TRUE,467.67,rsalomon8@state.tx.us,asphinxe8@jigsy.com,LG,Display,LED,1,"Lorem ipsum dolor sit amet, consectetuer adipiscing elit. Proin risus. Praesent lectus. Vestibulum quam sapien, varius ut, blandit non, interdum in, ante.",9
3/7/2022,7/13/2022,TRUE,568.61,fgomme9@engadget.com,bthys9@ucoz.com,LG,Power,LCD,5,"Integer non velit. Donec diam neque, vestibulum eget, vulputate ut, ultrices vel, augue. Vestibulum ante ipsum primis in faucibus orci luctus et ultrices posuere cubilia Curae; Donec pharetra, magna vestibulum aliquet ultrices, erat tortor sollicitudin mi, sit amet lobortis sapien sapien non mi. Integer ac neque. Duis bibendum.",10
3/7/2022,5/8/2023,TRUE,594.98,ikyndera@barnesandnoble.com,cbedlingtona@cafepress.com,Toshiba,Display,Speaker,3,"Quisque erat eros, viverra eget, congue eget, semper rutrum, nulla. Nunc purus. Phasellus in felis. Donec semper sapien a libero. Nam dui. Proin leo odio, porttitor id, consequat in, consequat ut, nulla. Sed accumsan felis. Ut at dolor quis odio consequat varius. Integer ac leo. Pellentesque ultrices mattis odio.",11
3/7/2022,2/16/2023,TRUE,339.51,apuddefootb@ycombinator.com,dkinneyb@example.com,Samsung,Power,Plasma,2,Nullam varius. Nulla facilisi. Cras non velit nec nisi vulputate nonummy.,12
3/7/2022,4/19/2023,FALSE,717.28,crestonc@latimes.com,hjanusikc@wikipedia.org,Panasonic,Power,Motherboard,3,"Donec posuere metus vitae ipsum. Aliquam non mauris. Morbi non lectus. Aliquam sit amet diam in magna bibendum imperdiet. Nullam orci pede, venenatis non, sodales sed, tincidunt eu, felis. Fusce posuere felis sed lacus. Morbi sem mauris, laoreet ut, rhoncus aliquet, pulvinar sed, nisl. Nunc rhoncus dui vel sem. Sed sagittis. Nam congue, risus semper porta volutpat, quam pede lobortis ligula, sit amet eleifend pede libero quis orci.",13
3/7/2022,8/27/2022,FALSE,987.67,aducarned@scientificamerican.com,lhuggardd@ameblo.jp,Toshiba,Other,LED,2,"Duis ac nibh. Fusce lacus purus, aliquet at, feugiat non, pretium quis, lectus. Suspendisse potenti. In eleifend quam a odio. In hac habitasse platea dictumst. Maecenas ut massa quis augue luctus tincidunt.",14
3/7/2022,9/21/2022,TRUE,980.82,vralphse@ycombinator.com,rtagge@xrea.com,Panasonic,Sound,Plasma,2,"Suspendisse potenti. Cras in purus eu magna vulputate luctus. Cum sociis natoque penatibus et magnis dis parturient montes, nascetur ridiculus mus. Vivamus vestibulum sagittis sapien. Cum sociis natoque penatibus et magnis dis parturient montes, nascetur ridiculus mus.",15
3/7/2022,2/6/2023,TRUE,68.92,belcocksf@devhub.com,astoodf@bluehost.com,Sony,Power,Plasma,4,"Nulla neque libero, convallis eget, eleifend luctus, ultricies eu, nibh. Quisque id justo sit amet sapien dignissim vestibulum. Vestibulum ante ipsum primis in faucibus orci luctus et ultrices posuere cubilia Curae; Nulla dapibus dolor vel est. Donec odio justo, sollicitudin ut, suscipit a, feugiat et, eros. Vestibulum ac est lacinia nisi venenatis tristique. Fusce congue, diam id ornare imperdiet, sapien urna pretium nisl, ut volutpat sapien arcu sed augue. Aliquam erat volutpat.",16
3/7/2022,6/20/2023,FALSE,133.59,gfrancomg@prnewswire.com,mhasleyg@cocolog-nifty.com,Samsung,Sound,LCD,5,"Duis bibendum. Morbi non quam nec dui luctus rutrum. Nulla tellus. In sagittis dui vel nisl. Duis ac nibh. Fusce lacus purus, aliquet at, feugiat non, pretium quis, lectus. Suspendisse potenti.",17
3/7/2022,12/4/2022,TRUE,855.9,leastlakeh@about.me,cescreeth@arizona.edu,Sony,Other,Motherboard,2,"Quisque porta volutpat erat. Quisque erat eros, viverra eget, congue eget, semper rutrum, nulla. Nunc purus. Phasellus in felis. Donec semper sapien a libero. Nam dui. Proin leo odio, porttitor id, consequat in, consequat ut, nulla. Sed accumsan felis. Ut at dolor quis odio consequat varius.",18
3/7/2022,9/27/2022,FALSE,421.76,lperigeauxi@umich.edu,jfransesi@cnbc.com,Samsung,Other,Motherboard,5,"Vestibulum quam sapien, varius ut, blandit non, interdum in, ante. Vestibulum ante ipsum primis in faucibus orci luctus et ultrices posuere cubilia Curae; Duis faucibus accumsan odio. Curabitur convallis. Duis consequat dui nec nisi volutpat eleifend. Donec ut dolor. Morbi vel lectus in quam fringilla rhoncus.",19
3/7/2022,1/23/2023,TRUE,604.88,bstanbridgej@cargocollective.com,boffieldj@themeforest.net,Panasonic,Connectivity,LED,4,Vestibulum sed magna at nunc commodo placerat. Praesent blandit. Nam nulla.,20
3/7/2022,11/4/2022,TRUE,194.22,mmyrickk@purevolume.com,tmalcolmsonk@sciencedirect.com,LG,Connectivity,LED,4,"In blandit ultrices enim. Lorem ipsum dolor sit amet, consectetuer adipiscing elit. Proin interdum mauris non ligula pellentesque ultrices. Phasellus id sapien in sapien iaculis congue. Vivamus metus arcu, adipiscing molestie, hendrerit at, vulputate vitae, nisl. Aenean lectus. Pellentesque eget nunc. Donec quis orci eget orci vehicula condimentum.",21
3/7/2022,6/4/2023,TRUE,717.81,acarlemanl@weather.com,jpulhosterl@123-reg.co.uk,Toshiba,Other,Speaker,5,"Proin leo odio, porttitor id, consequat in, consequat ut, nulla. Sed accumsan felis. Ut at dolor quis odio consequat varius.",22
3/7/2022,10/11/2022,TRUE,710.61,spettiem@macromedia.com,pnencim@cocolog-nifty.com,Toshiba,Connectivity,Motherboard,1,"Fusce posuere felis sed lacus. Morbi sem mauris, laoreet ut, rhoncus aliquet, pulvinar sed, nisl. Nunc rhoncus dui vel sem.",23
3/7/2022,10/26/2022,FALSE,956.44,gblindern@istockphoto.com,nhumphersonn@usnews.com,Sony,Power,Speaker,1,"Pellentesque eget nunc. Donec quis orci eget orci vehicula condimentum. Curabitur in libero ut massa volutpat convallis. Morbi odio odio, elementum eu, interdum eu, tincidunt in, leo. Maecenas pulvinar lobortis est. Phasellus sit amet erat.",24
3/7/2022,10/8/2022,FALSE,296.01,tsaladinoo@elpais.com,cheindleo@cbc.ca,Samsung,Connectivity,Plasma,5,Suspendisse potenti. Cras in purus eu magna vulputate luctus.,25
3/7/2022,10/8/2022,FALSE,450.77,mmcnevinp@miibeian.gov.cn,mmarchisop@flavors.me,Sony,Display,Motherboard,2,"Phasellus sit amet erat. Nulla tempus. Vivamus in felis eu sapien cursus vestibulum. Proin eu mi. Nulla ac enim. In tempor, turpis nec euismod scelerisque, quam turpis adipiscing lorem, vitae mattis nibh ligula nec sem. Duis aliquam convallis nunc.",26
3/7/2022,10/27/2022,TRUE,808.52,fmoormanq@chronoengine.com,etoffoliniq@berkeley.edu,Sony,Other,Speaker,1,"Curabitur gravida nisi at nibh. In hac habitasse platea dictumst. Aliquam augue quam, sollicitudin vitae, consectetuer eget, rutrum at, lorem. Integer tincidunt ante vel ipsum.",27
3/7/2022,7/5/2022,FALSE,22.11,dgardinerr@so-net.ne.jp,fwhebellr@seesaa.net,LG,Connectivity,Motherboard,1,"Mauris enim leo, rhoncus sed, vestibulum sit amet, cursus id, turpis. Integer aliquet, massa id lobortis convallis, tortor risus dapibus augue, vel accumsan tellus nisi eu orci. Mauris lacinia sapien quis libero. Nullam sit amet turpis elementum ligula vehicula consequat. Morbi a ipsum. Integer a nibh. In quis justo.",28
3/7/2022,11/15/2022,FALSE,634.54,pcollocotts@admin.ch,hchastangs@de.vu,Panasonic,Sound,LED,2,"Fusce congue, diam id ornare imperdiet, sapien urna pretium nisl, ut volutpat sapien arcu sed augue. Aliquam erat volutpat. In congue.",29
3/7/2022,5/26/2023,TRUE,468.41,mwiset@live.com,sholylandt@marriott.com,Samsung,Connectivity,Motherboard,2,"Nam ultrices, libero non mattis pulvinar, nulla pede ullamcorper augue, a suscipit nulla elit ac nulla. Sed vel enim sit amet nunc viverra dapibus. Nulla suscipit ligula in lacus.",30
3/7/2022,7/19/2022,FALSE,708.16,eastlingu@xrea.com,kgilderoyu@google.com.br,Panasonic,Power,Speaker,3,"Nam nulla. Integer pede justo, lacinia eget, tincidunt eget, tempus vel, pede.",31
3/7/2022,7/23/2022,TRUE,633.33,tclemensonv@hp.com,gradleyv@mashable.com,LG,Other,Speaker,1,"Fusce posuere felis sed lacus. Morbi sem mauris, laoreet ut, rhoncus aliquet, pulvinar sed, nisl. Nunc rhoncus dui vel sem. Sed sagittis. Nam congue, risus semper porta volutpat, quam pede lobortis ligula, sit amet eleifend pede libero quis orci.",32
3/7/2022,3/18/2023,FALSE,424.58,fpaviourw@nba.com,cayresw@people.com.cn,Samsung,Connectivity,LED,3,Aliquam quis turpis eget elit sodales scelerisque. Mauris sit amet eros.,33
3/7/2022,10/11/2022,FALSE,529.23,hkellawayx@macromedia.com,htivolierx@goo.ne.jp,Samsung,Connectivity,Speaker,0,In eleifend quam a odio. In hac habitasse platea dictumst. Maecenas ut massa quis augue luctus tincidunt. Nulla mollis molestie lorem. Quisque ut erat. Curabitur gravida nisi at nibh.,34
3/7/2022,5/3/2023,FALSE,253.43,jmacginleyy@privacy.gov.au,gaceyy@hostgator.com,Panasonic,Connectivity,Motherboard,1,In hac habitasse platea dictumst. Maecenas ut massa quis augue luctus tincidunt. Nulla mollis molestie lorem.,35
3/7/2022,9/13/2022,FALSE,423.13,lgroutz@simplemachines.org,pcowndleyz@marriott.com,Sony,Other,LED,2,"Nullam molestie nibh in lectus. Pellentesque at nulla. Suspendisse potenti. Cras in purus eu magna vulputate luctus. Cum sociis natoque penatibus et magnis dis parturient montes, nascetur ridiculus mus. Vivamus vestibulum sagittis sapien.",36
3/7/2022,6/24/2022,TRUE,275.6,flacrouts10@ustream.tv,tperle10@mtv.com,Sony,Connectivity,Speaker,5,"Maecenas ut massa quis augue luctus tincidunt. Nulla mollis molestie lorem. Quisque ut erat. Curabitur gravida nisi at nibh. In hac habitasse platea dictumst. Aliquam augue quam, sollicitudin vitae, consectetuer eget, rutrum at, lorem. Integer tincidunt ante vel ipsum. Praesent blandit lacinia erat. Vestibulum sed magna at nunc commodo placerat. Praesent blandit.",37
3/7/2022,4/3/2023,FALSE,870.06,jdurdan11@moonfruit.com,dlightoller11@tripod.com,LG,Other,Plasma,0,Pellentesque ultrices mattis odio. Donec vitae nisi.,38
3/7/2022,10/2/2022,TRUE,237.46,clambeth12@bravesites.com,gfife12@tripadvisor.com,Sony,Power,Speaker,4,Quisque id justo sit amet sapien dignissim vestibulum. Vestibulum ante ipsum primis in faucibus orci luctus et ultrices posuere cubilia Curae; Nulla dapibus dolor vel est.,39
3/7/2022,4/24/2023,TRUE,701.49,aquakley13@xing.com,rstoodley13@1und1.de,Samsung,Display,LCD,0,"Cras in purus eu magna vulputate luctus. Cum sociis natoque penatibus et magnis dis parturient montes, nascetur ridiculus mus.",40
3/7/2022,10/19/2022,FALSE,219.67,rcordeau14@youku.com,ekleyn14@people.com.cn,Toshiba,Sound,Motherboard,1,"Vivamus in felis eu sapien cursus vestibulum. Proin eu mi. Nulla ac enim. In tempor, turpis nec euismod scelerisque, quam turpis adipiscing lorem, vitae mattis nibh ligula nec sem.",41
3/7/2022,6/1/2023,TRUE,676.61,tdobrovolski15@patch.com,cfabbri15@paginegialle.it,Toshiba,Sound,Speaker,1,Vestibulum rutrum rutrum neque. Aenean auctor gravida sem. Praesent id massa id nisl venenatis lacinia. Aenean sit amet justo.,42
3/7/2022,12/1/2022,FALSE,700.75,eluther16@phoca.cz,rmckew16@unblog.fr,LG,Display,LCD,2,"Praesent blandit. Nam nulla. Integer pede justo, lacinia eget, tincidunt eget, tempus vel, pede. Morbi porttitor lorem id ligula. Suspendisse ornare consequat lectus. In est risus, auctor sed, tristique in, tempus sit amet, sem. Fusce consequat. Nulla nisl. Nunc nisl.",43
3/7/2022,6/15/2023,TRUE,625.77,flabes17@etsy.com,slashley17@netvibes.com,Samsung,Display,Plasma,2,"Integer a nibh. In quis justo. Maecenas rhoncus aliquam lacus. Morbi quis tortor id nulla ultrices aliquet. Maecenas leo odio, condimentum id, luctus nec, molestie sed, justo.",44
3/7/2022,7/15/2022,TRUE,400.9,fgookes18@youtube.com,rcoates18@imdb.com,Sony,Sound,LCD,0,"Nullam varius. Nulla facilisi. Cras non velit nec nisi vulputate nonummy. Maecenas tincidunt lacus at velit. Vivamus vel nulla eget eros elementum pellentesque. Quisque porta volutpat erat. Quisque erat eros, viverra eget, congue eget, semper rutrum, nulla. Nunc purus. Phasellus in felis. Donec semper sapien a libero.",45
3/9/2022,8/2/2022,TRUE,492.67,jmeany19@google.nl,nland19@rambler.ru,LG,Sound,Motherboard,4,Nulla mollis molestie lorem.,46
3/9/2022,2/15/2023,FALSE,901.82,damy1a@nature.com,utender1a@biglobe.ne.jp,Toshiba,Connectivity,Plasma,5,Maecenas pulvinar lobortis est. Phasellus sit amet erat.,47
3/9/2022,8/21/2022,TRUE,9.55,dlindell1b@guardian.co.uk,kspring1b@ustream.tv,Samsung,Power,LCD,3,Integer a nibh.,48
3/9/2022,7/3/2022,FALSE,796.01,bbricket1c@shinystat.com,djersch1c@fc2.com,LG,Display,LCD,1,"Quisque id justo sit amet sapien dignissim vestibulum. Vestibulum ante ipsum primis in faucibus orci luctus et ultrices posuere cubilia Curae; Nulla dapibus dolor vel est. Donec odio justo, sollicitudin ut, suscipit a, feugiat et, eros. Vestibulum ac est lacinia nisi venenatis tristique.",49
3/9/2022,2/8/2023,FALSE,660.92,agaven1d@dropbox.com,jbranton1d@samsung.com,Toshiba,Connectivity,Speaker,1,"Suspendisse potenti. Nullam porttitor lacus at turpis. Donec posuere metus vitae ipsum. Aliquam non mauris. Morbi non lectus. Aliquam sit amet diam in magna bibendum imperdiet. Nullam orci pede, venenatis non, sodales sed, tincidunt eu, felis. Fusce posuere felis sed lacus. Morbi sem mauris, laoreet ut, rhoncus aliquet, pulvinar sed, nisl.",50
3/9/2022,8/17/2022,TRUE,14.46,rduinbleton1e@issuu.com,abradnick1e@wikimedia.org,Panasonic,Power,Speaker,3,"In eleifend quam a odio. In hac habitasse platea dictumst. Maecenas ut massa quis augue luctus tincidunt. Nulla mollis molestie lorem. Quisque ut erat. Curabitur gravida nisi at nibh. In hac habitasse platea dictumst. Aliquam augue quam, sollicitudin vitae, consectetuer eget, rutrum at, lorem. Integer tincidunt ante vel ipsum. Praesent blandit lacinia erat.",51
3/9/2022,10/14/2022,FALSE,753.84,bhowchin1f@desdev.cn,manetts1f@scientificamerican.com,Samsung,Other,Motherboard,1,Duis at velit eu est congue elementum.,52
3/9/2022,11/7/2022,FALSE,23.24,sgallelli1g@msn.com,kshearstone1g@dedecms.com,LG,Power,Plasma,4,Etiam faucibus cursus urna. Ut tellus. Nulla ut erat id mauris vulputate elementum.,53
3/9/2022,9/19/2022,FALSE,993.17,hhyland1h@army.mil,bikin1h@who.int,LG,Display,Motherboard,4,"Duis ac nibh. Fusce lacus purus, aliquet at, feugiat non, pretium quis, lectus. Suspendisse potenti. In eleifend quam a odio.",54
3/9/2022,3/27/2023,FALSE,325.68,afaulo1i@about.com,sdanzey1i@usda.gov,Sony,Other,Motherboard,2,"Morbi vestibulum, velit id pretium iaculis, diam erat fermentum justo, nec condimentum neque sapien placerat ante. Nulla justo. Aliquam quis turpis eget elit sodales scelerisque.",55
3/9/2022,1/10/2023,TRUE,981.61,hlanaway1j@washingtonpost.com,kgetsham1j@unesco.org,Samsung,Connectivity,Motherboard,1,"Phasellus id sapien in sapien iaculis congue. Vivamus metus arcu, adipiscing molestie, hendrerit at, vulputate vitae, nisl.",56
3/9/2022,10/5/2022,TRUE,600.79,emattin1k@apple.com,mantosch1k@ebay.co.uk,LG,Other,LCD,2,"Fusce lacus purus, aliquet at, feugiat non, pretium quis, lectus. Suspendisse potenti. In eleifend quam a odio. In hac habitasse platea dictumst. Maecenas ut massa quis augue luctus tincidunt. Nulla mollis molestie lorem. Quisque ut erat. Curabitur gravida nisi at nibh. In hac habitasse platea dictumst. Aliquam augue quam, sollicitudin vitae, consectetuer eget, rutrum at, lorem.",57
3/9/2022,7/8/2022,TRUE,415.64,hgendricke1l@flavors.me,tching1l@vinaora.com,Panasonic,Power,Motherboard,0,"Pellentesque viverra pede ac diam. Cras pellentesque volutpat dui. Maecenas tristique, est et tempus semper, est quam pharetra magna, ac consequat metus sapien ut nunc. Vestibulum ante ipsum primis in faucibus orci luctus et ultrices posuere cubilia Curae; Mauris viverra diam vitae quam. Suspendisse potenti. Nullam porttitor lacus at turpis. Donec posuere metus vitae ipsum. Aliquam non mauris. Morbi non lectus.",58
3/9/2022,2/24/2023,FALSE,641.58,kpettiford1m@hhs.gov,tmerritt1m@flavors.me,LG,Sound,Speaker,3,"Duis bibendum, felis sed interdum venenatis, turpis enim blandit mi, in porttitor pede justo eu massa. Donec dapibus. Duis at velit eu est congue elementum. In hac habitasse platea dictumst. Morbi vestibulum, velit id pretium iaculis, diam erat fermentum justo, nec condimentum neque sapien placerat ante. Nulla justo.",59
3/9/2022,8/26/2022,TRUE,338.18,rvandaalen1n@state.gov,jdeem1n@archive.org,LG,Power,Motherboard,5,Donec quis orci eget orci vehicula condimentum. Curabitur in libero ut massa volutpat convallis.,60
3/9/2022,10/3/2022,TRUE,667.24,dnemchinov1o@craigslist.org,cbuxton1o@wufoo.com,Sony,Power,Plasma,3,Etiam justo. Etiam pretium iaculis justo. In hac habitasse platea dictumst. Etiam faucibus cursus urna. Ut tellus. Nulla ut erat id mauris vulputate elementum. Nullam varius.,61
3/9/2022,4/4/2023,TRUE,255.34,hbraisby1p@nymag.com,wdegliabbati1p@whitehouse.gov,Panasonic,Connectivity,Motherboard,0,Sed ante. Vivamus tortor.,62
3/9/2022,12/8/2022,FALSE,81.19,wscutter1q@wiley.com,nbugg1q@vk.com,Sony,Other,Motherboard,4,Sed ante. Vivamus tortor. Duis mattis egestas metus. Aenean fermentum.,63
3/9/2022,7/6/2022,FALSE,370.74,ekirstein1r@sakura.ne.jp,ecawker1r@usatoday.com,Sony,Power,LED,4,Nam tristique tortor eu pede.,64
3/9/2022,11/23/2022,FALSE,688.55,clacky1s@utexas.edu,cybarra1s@google.es,Samsung,Sound,Motherboard,5,"In quis justo. Maecenas rhoncus aliquam lacus. Morbi quis tortor id nulla ultrices aliquet. Maecenas leo odio, condimentum id, luctus nec, molestie sed, justo.",65
3/9/2022,8/23/2022,TRUE,526.27,rscully1t@photobucket.com,espennock1t@desdev.cn,Sony,Sound,Speaker,3,"Aliquam sit amet diam in magna bibendum imperdiet. Nullam orci pede, venenatis non, sodales sed, tincidunt eu, felis. Fusce posuere felis sed lacus. Morbi sem mauris, laoreet ut, rhoncus aliquet, pulvinar sed, nisl. Nunc rhoncus dui vel sem. Sed sagittis. Nam congue, risus semper porta volutpat, quam pede lobortis ligula, sit amet eleifend pede libero quis orci. Nullam molestie nibh in lectus.",66
3/9/2022,9/26/2022,TRUE,991.95,mmckune1u@ucoz.com,smcgaughie1u@hc360.com,LG,Connectivity,Speaker,4,"Vestibulum ante ipsum primis in faucibus orci luctus et ultrices posuere cubilia Curae; Donec pharetra, magna vestibulum aliquet ultrices, erat tortor sollicitudin mi, sit amet lobortis sapien sapien non mi. Integer ac neque. Duis bibendum. Morbi non quam nec dui luctus rutrum.",67
3/9/2022,6/30/2022,FALSE,218,kselwin1v@columbia.edu,mdalessio1v@networkadvertising.org,Panasonic,Connectivity,LED,3,"Lorem ipsum dolor sit amet, consectetuer adipiscing elit. Proin risus. Praesent lectus. Vestibulum quam sapien, varius ut, blandit non, interdum in, ante. Vestibulum ante ipsum primis in faucibus orci luctus et ultrices posuere cubilia Curae; Duis faucibus accumsan odio.",68
3/9/2022,10/19/2022,FALSE,918.7,rsimmen1w@un.org,wbarnardo1w@huffingtonpost.com,Toshiba,Power,Motherboard,4,"Donec odio justo, sollicitudin ut, suscipit a, feugiat et, eros. Vestibulum ac est lacinia nisi venenatis tristique. Fusce congue, diam id ornare imperdiet, sapien urna pretium nisl, ut volutpat sapien arcu sed augue. Aliquam erat volutpat. In congue. Etiam justo.",69
3/9/2022,1/11/2023,FALSE,715.48,rduddell1x@sciencedirect.com,lgoning1x@uiuc.edu,Panasonic,Power,LCD,4,Etiam justo. Etiam pretium iaculis justo. In hac habitasse platea dictumst.,70
3/9/2022,2/2/2023,TRUE,816.68,lcapoun1y@youtube.com,tmunroe1y@etsy.com,Sony,Other,Speaker,0,Duis bibendum. Morbi non quam nec dui luctus rutrum.,71
3/9/2022,3/18/2023,TRUE,545.9,dmatyushenko1z@google.fr,rbreslane1z@biglobe.ne.jp,Samsung,Sound,LCD,4,Nunc rhoncus dui vel sem.,72
3/9/2022,10/8/2022,FALSE,852.77,kstubs20@google.cn,ssamways20@jigsy.com,Toshiba,Power,LCD,4,"Maecenas rhoncus aliquam lacus. Morbi quis tortor id nulla ultrices aliquet. Maecenas leo odio, condimentum id, luctus nec, molestie sed, justo.",73
3/9/2022,8/31/2022,FALSE,737.69,bbumpus21@globo.com,ttomlins21@si.edu,Toshiba,Power,Motherboard,4,"Donec ut mauris eget massa tempor convallis. Nulla neque libero, convallis eget, eleifend luctus, ultricies eu, nibh. Quisque id justo sit amet sapien dignissim vestibulum. Vestibulum ante ipsum primis in faucibus orci luctus et ultrices posuere cubilia Curae; Nulla dapibus dolor vel est. Donec odio justo, sollicitudin ut, suscipit a, feugiat et, eros. Vestibulum ac est lacinia nisi venenatis tristique. Fusce congue, diam id ornare imperdiet, sapien urna pretium nisl, ut volutpat sapien arcu sed augue. Aliquam erat volutpat. In congue. Etiam justo.",74
3/8/2022,2/28/2023,TRUE,538.92,amattiassi22@admin.ch,iwinpenny22@who.int,Samsung,Other,Plasma,4,"In est risus, auctor sed, tristique in, tempus sit amet, sem.",75
3/9/2022,5/4/2023,TRUE,72.86,abrezlaw23@cisco.com,mantal23@nasa.gov,Panasonic,Power,Motherboard,0,Etiam pretium iaculis justo. In hac habitasse platea dictumst. Etiam faucibus cursus urna. Ut tellus. Nulla ut erat id mauris vulputate elementum. Nullam varius. Nulla facilisi.,76
3/9/2022,10/31/2022,TRUE,549.75,sbromage24@issuu.com,lkershaw24@ihg.com,Sony,Sound,LED,3,"Integer aliquet, massa id lobortis convallis, tortor risus dapibus augue, vel accumsan tellus nisi eu orci. Mauris lacinia sapien quis libero. Nullam sit amet turpis elementum ligula vehicula consequat. Morbi a ipsum. Integer a nibh. In quis justo.",77
3/9/2022,10/4/2022,FALSE,534.15,lsantry25@mozilla.com,sscraney25@hubpages.com,Toshiba,Sound,Plasma,2,"Integer ac leo. Pellentesque ultrices mattis odio. Donec vitae nisi. Nam ultrices, libero non mattis pulvinar, nulla pede ullamcorper augue, a suscipit nulla elit ac nulla. Sed vel enim sit amet nunc viverra dapibus.",78
3/9/2022,3/24/2023,TRUE,707.58,obradtke26@acquirethisname.com,jreboul26@flickr.com,Sony,Sound,Plasma,4,"Morbi ut odio. Cras mi pede, malesuada in, imperdiet et, commodo vulputate, justo. In blandit ultrices enim. Lorem ipsum dolor sit amet, consectetuer adipiscing elit. Proin interdum mauris non ligula pellentesque ultrices. Phasellus id sapien in sapien iaculis congue.",79
3/9/2022,7/15/2022,FALSE,646.13,gbrownfield27@printfriendly.com,fgosse27@amazonaws.com,Sony,Other,LCD,4,Vestibulum ante ipsum primis in faucibus orci luctus et ultrices posuere cubilia Curae; Duis faucibus accumsan odio. Curabitur convallis. Duis consequat dui nec nisi volutpat eleifend.,80
3/9/2022,5/31/2023,FALSE,337.28,jablewhite28@feedburner.com,amainstone28@jalbum.net,Panasonic,Display,LED,0,"Maecenas rhoncus aliquam lacus. Morbi quis tortor id nulla ultrices aliquet. Maecenas leo odio, condimentum id, luctus nec, molestie sed, justo. Pellentesque viverra pede ac diam. Cras pellentesque volutpat dui.",81
3/9/2022,2/24/2023,FALSE,11.38,cmclenahan29@nhs.uk,wkenewel29@npr.org,Toshiba,Connectivity,Motherboard,3,"Integer ac leo. Pellentesque ultrices mattis odio. Donec vitae nisi. Nam ultrices, libero non mattis pulvinar, nulla pede ullamcorper augue, a suscipit nulla elit ac nulla.",82
3/9/2022,9/10/2022,FALSE,235.74,rtrahmel2a@census.gov,tgrishunin2a@technorati.com,Samsung,Other,Speaker,2,Nulla facilisi. Cras non velit nec nisi vulputate nonummy.,83
