3/16/2022,4/13/2023,TRUE,552,truttgersk8@zdnet.com,dcrosek8@about.com,Sony,Sound,LED,3,Duis ac nibh.,729
3/16/2022,5/8/2023,FALSE,230.34,stestk9@ezinearticles.com,nrouffk9@is.gd,LG,Connectivity,LED,3,Aliquam quis turpis eget elit sodales scelerisque.,730
3/16/2022,6/27/2022,FALSE,818.72,cambrogiottika@vimeo.com,awitherka@npr.org,Samsung,Display,Plasma,0,"In sagittis dui vel nisl. Duis ac nibh. Fusce lacus purus, aliquet at, feugiat non, pretium quis, lectus. Suspendisse potenti. In eleifend quam a odio. In hac habitasse platea dictumst. Maecenas ut massa quis augue luctus tincidunt.",731
3/16/2022,3/28/2023,TRUE,274.88,mmidghallkb@yellowbook.com,ltruslerkb@cargocollective.com,LG,Sound,LED,4,"Vestibulum rutrum rutrum neque. Aenean auctor gravida sem. Praesent id massa id nisl venenatis lacinia. Aenean sit amet justo. Morbi ut odio. Cras mi pede, malesuada in, imperdiet et, commodo vulputate, justo. In blandit ultrices enim. Lorem ipsum dolor sit amet, consectetuer adipiscing elit. Proin interdum mauris non ligula pellentesque ultrices. Phasellus id sapien in sapien iaculis congue.",732
3/16/2022,1/25/2023,TRUE,447.22,cwagstaffekc@parallels.com,hodonoghuekc@prlog.org,LG,Display,Speaker,1,"Cras non velit nec nisi vulputate nonummy. Maecenas tincidunt lacus at velit. Vivamus vel nulla eget eros elementum pellentesque. Quisque porta volutpat erat. Quisque erat eros, viverra eget, congue eget, semper rutrum, nulla. Nunc purus. Phasellus in felis. Donec semper sapien a libero. Nam dui. Proin leo odio, porttitor id, consequat in, consequat ut, nulla.",733
3/16/2022,9/22/2022,TRUE,1.04,gtennetkd@marketwatch.com,jareleskd@de.vu,Sony,Connectivity,Plasma,3,Phasellus id sapien in sapien iaculis congue.,734
3/16/2022,9/3/2022,FALSE,375.13,mpetticrowke@twitpic.com,vbackke@goo.gl,Samsung,Connectivity,LCD,2,Maecenas tincidunt lacus at velit. Vivamus vel nulla eget eros elementum pellentesque. Quisque porta volutpat erat.,735
3/16/2022,7/16/2022,FALSE,660.19,dcowmeadowkf@tripadvisor.com,fcoulmankf@auda.org.au,LG,Display,LED,4,"Donec ut dolor. Morbi vel lectus in quam fringilla rhoncus. Mauris enim leo, rhoncus sed, vestibulum sit amet, cursus id, turpis. Integer aliquet, massa id lobortis convallis, tortor risus dapibus augue, vel accumsan tellus nisi eu orci. Mauris lacinia sapien quis libero. Nullam sit amet turpis elementum ligula vehicula consequat. Morbi a ipsum. Integer a nibh. In quis justo.",736
3/16/2022,1/4/2023,TRUE,669.3,cantonkg@free.fr,mwabersinkekg@phpbb.com,Toshiba,Connectivity,Plasma,3,"Cras pellentesque volutpat dui. Maecenas tristique, est et tempus semper, est quam pharetra magna, ac consequat metus sapien ut nunc. Vestibulum ante ipsum primis in faucibus orci luctus et ultrices posuere cubilia Curae; Mauris viverra diam vitae quam. Suspendisse potenti.",737
3/16/2022,12/16/2022,TRUE,806.98,vsporekh@chicagotribune.com,gkonerdingkh@pbs.org,Sony,Other,Speaker,1,"Donec ut mauris eget massa tempor convallis. Nulla neque libero, convallis eget, eleifend luctus, ultricies eu, nibh. Quisque id justo sit amet sapien dignissim vestibulum. Vestibulum ante ipsum primis in faucibus orci luctus et ultrices posuere cubilia Curae; Nulla dapibus dolor vel est. Donec odio justo, sollicitudin ut, suscipit a, feugiat et, eros. Vestibulum ac est lacinia nisi venenatis tristique. Fusce congue, diam id ornare imperdiet, sapien urna pretium nisl, ut volutpat sapien arcu sed augue. Aliquam erat volutpat.",738
3/16/2022,3/7/2023,TRUE,626.97,cimlinki@bing.com,agarzki@irs.gov,Samsung,Other,LCD,4,Etiam justo. Etiam pretium iaculis justo. In hac habitasse platea dictumst.,739
3/16/2022,2/19/2023,FALSE,441.76,ogoslingkj@google.cn,jbirthkj@ucsd.edu,Samsung,Connectivity,Plasma,1,"Cras pellentesque volutpat dui. Maecenas tristique, est et tempus semper, est quam pharetra magna, ac consequat metus sapien ut nunc. Vestibulum ante ipsum primis in faucibus orci luctus et ultrices posuere cubilia Curae; Mauris viverra diam vitae quam. Suspendisse potenti. Nullam porttitor lacus at turpis. Donec posuere metus vitae ipsum. Aliquam non mauris.",740
3/16/2022,8/2/2022,FALSE,846.31,nsiburnkk@kickstarter.com,lbalaamkk@hubpages.com,Sony,Display,Plasma,3,"Maecenas tincidunt lacus at velit. Vivamus vel nulla eget eros elementum pellentesque. Quisque porta volutpat erat. Quisque erat eros, viverra eget, congue eget, semper rutrum, nulla. Nunc purus. Phasellus in felis. Donec semper sapien a libero.",741
3/16/2022,3/29/2023,TRUE,462.46,mheintschkl@scientificamerican.com,arawdallkl@toplist.cz,Samsung,Connectivity,Plasma,3,"Sed sagittis. Nam congue, risus semper porta volutpat, quam pede lobortis ligula, sit amet eleifend pede libero quis orci. Nullam molestie nibh in lectus.",742
3/16/2022,2/21/2023,FALSE,217.41,kgillimghamkm@telegraph.co.uk,bglaisnerkm@parallels.com,Samsung,Connectivity,Motherboard,4,"Maecenas rhoncus aliquam lacus. Morbi quis tortor id nulla ultrices aliquet. Maecenas leo odio, condimentum id, luctus nec, molestie sed, justo. Pellentesque viverra pede ac diam. Cras pellentesque volutpat dui. Maecenas tristique, est et tempus semper, est quam pharetra magna, ac consequat metus sapien ut nunc. Vestibulum ante ipsum primis in faucibus orci luctus et ultrices posuere cubilia Curae; Mauris viverra diam vitae quam. Suspendisse potenti. Nullam porttitor lacus at turpis.",743
3/16/2022,3/15/2023,TRUE,872.9,nbraitlingkn@irs.gov,mamoorekn@nih.gov,Samsung,Display,Speaker,4,Etiam vel augue. Vestibulum rutrum rutrum neque. Aenean auctor gravida sem. Praesent id massa id nisl venenatis lacinia. Aenean sit amet justo.,744
3/16/2022,6/23/2023,FALSE,277.19,jcreasyko@yandex.ru,tkitchersideko@hud.gov,Samsung,Connectivity,LCD,2,"In blandit ultrices enim. Lorem ipsum dolor sit amet, consectetuer adipiscing elit.",745
3/16/2022,8/9/2022,FALSE,188.06,glogsdalekp@histats.com,vstclairkp@unicef.org,LG,Other,Plasma,5,Etiam pretium iaculis justo. In hac habitasse platea dictumst. Etiam faucibus cursus urna. Ut tellus. Nulla ut erat id mauris vulputate elementum. Nullam varius. Nulla facilisi. Cras non velit nec nisi vulputate nonummy. Maecenas tincidunt lacus at velit.,746
3/16/2022,4/16/2023,TRUE,856.56,ybartolommeokq@opera.com,fwoodkq@google.pl,Panasonic,Power,Plasma,3,Morbi a ipsum. Integer a nibh. In quis justo.,747
3/16/2022,3/7/2023,FALSE,703.5,owolfendenkr@examiner.com,ttraitekr@webmd.com,LG,Display,Plasma,1,Nulla facilisi.,748
3/16/2022,7/3/2022,FALSE,109.02,fscreechks@oracle.com,ncowperks@cmu.edu,LG,Other,Motherboard,3,Sed accumsan felis. Ut at dolor quis odio consequat varius. Integer ac leo.,749
3/16/2022,6/8/2023,FALSE,451.97,sizacenkokt@eventbrite.com,awhetlandkt@domainmarket.com,LG,Power,LCD,0,"Quisque erat eros, viverra eget, congue eget, semper rutrum, nulla. Nunc purus. Phasellus in felis. Donec semper sapien a libero. Nam dui. Proin leo odio, porttitor id, consequat in, consequat ut, nulla. Sed accumsan felis. Ut at dolor quis odio consequat varius.",750
3/16/2022,11/16/2022,FALSE,34.87,ccoakerku@lycos.com,hemettku@mlb.com,Panasonic,Power,Speaker,2,"Morbi vestibulum, velit id pretium iaculis, diam erat fermentum justo, nec condimentum neque sapien placerat ante. Nulla justo. Aliquam quis turpis eget elit sodales scelerisque. Mauris sit amet eros. Suspendisse accumsan tortor quis turpis.",751
3/16/2022,10/25/2022,FALSE,591.18,kautykv@arizona.edu,cbowfinkv@wp.com,LG,Display,LCD,1,"In hac habitasse platea dictumst. Morbi vestibulum, velit id pretium iaculis, diam erat fermentum justo, nec condimentum neque sapien placerat ante. Nulla justo. Aliquam quis turpis eget elit sodales scelerisque. Mauris sit amet eros. Suspendisse accumsan tortor quis turpis. Sed ante. Vivamus tortor. Duis mattis egestas metus.",752
3/16/2022,4/26/2023,FALSE,640.3,blurnerkw@drupal.org,speacockkw@reddit.com,Panasonic,Connectivity,Speaker,2,"Praesent lectus. Vestibulum quam sapien, varius ut, blandit non, interdum in, ante. Vestibulum ante ipsum primis in faucibus orci luctus et ultrices posuere cubilia Curae; Duis faucibus accumsan odio. Curabitur convallis. Duis consequat dui nec nisi volutpat eleifend.",753
3/16/2022,10/15/2022,TRUE,886.72,mosheerinkx@huffingtonpost.com,rdalliwaterkx@cornell.edu,Samsung,Connectivity,LCD,5,Aliquam erat volutpat. In congue.,754
3/16/2022,12/7/2022,FALSE,524.83,akinderky@usa.gov,blentky@va.gov,Panasonic,Display,Plasma,4,Morbi a ipsum. Integer a nibh. In quis justo. Maecenas rhoncus aliquam lacus.,755
3/16/2022,2/25/2023,FALSE,142.65,jtromankz@harvard.edu,jhiggoekz@com.com,LG,Display,LED,1,"Maecenas rhoncus aliquam lacus. Morbi quis tortor id nulla ultrices aliquet. Maecenas leo odio, condimentum id, luctus nec, molestie sed, justo. Pellentesque viverra pede ac diam. Cras pellentesque volutpat dui.",756
3/16/2022,8/25/2022,FALSE,352.72,fburkmanl0@upenn.edu,opoyzerl0@histats.com,Sony,Sound,Speaker,4,Maecenas ut massa quis augue luctus tincidunt. Nulla mollis molestie lorem.,757
3/16/2022,8/31/2022,TRUE,915.73,raskhaml1@phoca.cz,rhursthousel1@ebay.com,Sony,Display,Plasma,1,"Cras non velit nec nisi vulputate nonummy. Maecenas tincidunt lacus at velit. Vivamus vel nulla eget eros elementum pellentesque. Quisque porta volutpat erat. Quisque erat eros, viverra eget, congue eget, semper rutrum, nulla. Nunc purus.",758
3/16/2022,6/18/2023,FALSE,160.33,kfressonl2@goo.gl,jsandiferl2@hhs.gov,Panasonic,Other,Speaker,1,"Morbi quis tortor id nulla ultrices aliquet. Maecenas leo odio, condimentum id, luctus nec, molestie sed, justo. Pellentesque viverra pede ac diam. Cras pellentesque volutpat dui.",759
3/16/2022,12/15/2022,FALSE,49.22,amaconl3@meetup.com,cshorttl3@paginegialle.it,Samsung,Sound,Motherboard,1,"Aenean sit amet justo. Morbi ut odio. Cras mi pede, malesuada in, imperdiet et, commodo vulputate, justo. In blandit ultrices enim. Lorem ipsum dolor sit amet, consectetuer adipiscing elit.",760
3/16/2022,8/10/2022,FALSE,117.57,kbladel4@histats.com,ruebell4@scribd.com,Samsung,Sound,Motherboard,4,Maecenas rhoncus aliquam lacus.,761
3/16/2022,10/18/2022,TRUE,282.12,sbertotl5@zimbio.com,jstanierl5@wikimedia.org,Sony,Sound,LED,3,"Aliquam sit amet diam in magna bibendum imperdiet. Nullam orci pede, venenatis non, sodales sed, tincidunt eu, felis. Fusce posuere felis sed lacus. Morbi sem mauris, laoreet ut, rhoncus aliquet, pulvinar sed, nisl. Nunc rhoncus dui vel sem.",762
3/16/2022,4/25/2023,TRUE,880.24,azavattaril6@rambler.ru,ngortonl6@accuweather.com,Panasonic,Connectivity,Speaker,3,"In blandit ultrices enim. Lorem ipsum dolor sit amet, consectetuer adipiscing elit. Proin interdum mauris non ligula pellentesque ultrices. Phasellus id sapien in sapien iaculis congue. Vivamus metus arcu, adipiscing molestie, hendrerit at, vulputate vitae, nisl. Aenean lectus. Pellentesque eget nunc. Donec quis orci eget orci vehicula condimentum.",763
3/16/2022,12/23/2022,FALSE,211.29,afedoronkol7@google.it,edomengel7@geocities.jp,Panasonic,Other,LED,1,"Vestibulum ante ipsum primis in faucibus orci luctus et ultrices posuere cubilia Curae; Donec pharetra, magna vestibulum aliquet ultrices, erat tortor sollicitudin mi, sit amet lobortis sapien sapien non mi. Integer ac neque. Duis bibendum. Morbi non quam nec dui luctus rutrum.",764
3/16/2022,5/16/2023,TRUE,709.53,bferrandl8@aboutads.info,dgladdifhl8@icio.us,Samsung,Power,Plasma,2,"Nulla ut erat id mauris vulputate elementum. Nullam varius. Nulla facilisi. Cras non velit nec nisi vulputate nonummy. Maecenas tincidunt lacus at velit. Vivamus vel nulla eget eros elementum pellentesque. Quisque porta volutpat erat. Quisque erat eros, viverra eget, congue eget, semper rutrum, nulla. Nunc purus. Phasellus in felis.",765
3/16/2022,7/3/2022,FALSE,310.08,nstewartl9@biglobe.ne.jp,ftodl9@yellowbook.com,Toshiba,Other,LED,4,"Donec ut mauris eget massa tempor convallis. Nulla neque libero, convallis eget, eleifend luctus, ultricies eu, nibh. Quisque id justo sit amet sapien dignissim vestibulum.",766
3/16/2022,9/12/2022,TRUE,558.31,badkinla@flavors.me,rspittallla@wufoo.com,Panasonic,Display,Speaker,2,"Vestibulum rutrum rutrum neque. Aenean auctor gravida sem. Praesent id massa id nisl venenatis lacinia. Aenean sit amet justo. Morbi ut odio. Cras mi pede, malesuada in, imperdiet et, commodo vulputate, justo.",767
3/16/2022,9/26/2022,TRUE,224.46,kpoylelb@dailymail.co.uk,lswainslb@wikia.com,Sony,Power,LCD,3,"Maecenas tincidunt lacus at velit. Vivamus vel nulla eget eros elementum pellentesque. Quisque porta volutpat erat. Quisque erat eros, viverra eget, congue eget, semper rutrum, nulla.",768
3/16/2022,10/25/2022,TRUE,530.07,tjollandslc@typepad.com,sdumbrilllc@theguardian.com,Sony,Sound,LED,1,"Duis ac nibh. Fusce lacus purus, aliquet at, feugiat non, pretium quis, lectus. Suspendisse potenti. In eleifend quam a odio. In hac habitasse platea dictumst.",769
3/16/2022,10/23/2022,FALSE,331.88,jlelandld@sphinn.com,smeasorld@linkedin.com,Toshiba,Connectivity,LED,4,Vestibulum ante ipsum primis in faucibus orci luctus et ultrices posuere cubilia Curae; Mauris viverra diam vitae quam. Suspendisse potenti. Nullam porttitor lacus at turpis. Donec posuere metus vitae ipsum. Aliquam non mauris. Morbi non lectus. Aliquam sit amet diam in magna bibendum imperdiet.,770
3/16/2022,10/15/2022,TRUE,732.91,gabbissle@g.co,sroskamsle@wikia.com,Sony,Display,LCD,3,Morbi non quam nec dui luctus rutrum.,771
3/16/2022,3/18/2023,TRUE,287.6,eyorkelf@jalbum.net,epaynelf@princeton.edu,Sony,Display,Plasma,0,"Quisque ut erat. Curabitur gravida nisi at nibh. In hac habitasse platea dictumst. Aliquam augue quam, sollicitudin vitae, consectetuer eget, rutrum at, lorem. Integer tincidunt ante vel ipsum. Praesent blandit lacinia erat.",772
3/16/2022,7/30/2022,FALSE,85.61,sarnisonlg@zdnet.com,aniessenlg@simplemachines.org,LG,Other,Speaker,5,"Proin leo odio, porttitor id, consequat in, consequat ut, nulla. Sed accumsan felis. Ut at dolor quis odio consequat varius. Integer ac leo. Pellentesque ultrices mattis odio. Donec vitae nisi. Nam ultrices, libero non mattis pulvinar, nulla pede ullamcorper augue, a suscipit nulla elit ac nulla. Sed vel enim sit amet nunc viverra dapibus.",773
3/16/2022,9/28/2022,FALSE,18.22,bvarseylh@technorati.com,nmaudlh@google.pl,Sony,Display,LCD,4,"Fusce lacus purus, aliquet at, feugiat non, pretium quis, lectus. Suspendisse potenti. In eleifend quam a odio. In hac habitasse platea dictumst. Maecenas ut massa quis augue luctus tincidunt.",774
3/16/2022,9/26/2022,TRUE,728.52,bstanmanli@google.com,zrevensli@nifty.com,LG,Connectivity,LED,2,"Aenean lectus. Pellentesque eget nunc. Donec quis orci eget orci vehicula condimentum. Curabitur in libero ut massa volutpat convallis. Morbi odio odio, elementum eu, interdum eu, tincidunt in, leo.",775
3/16/2022,1/18/2023,TRUE,244.92,kkreutzerlj@statcounter.com,hbelchamberlj@nytimes.com,Sony,Power,LCD,3,Pellentesque viverra pede ac diam. Cras pellentesque volutpat dui.,776
3/16/2022,11/19/2022,FALSE,66.51,adelacourtlk@go.com,bhowerdlk@altervista.org,LG,Connectivity,LED,5,Vestibulum ante ipsum primis in faucibus orci luctus et ultrices posuere cubilia Curae; Mauris viverra diam vitae quam. Suspendisse potenti. Nullam porttitor lacus at turpis. Donec posuere metus vitae ipsum. Aliquam non mauris. Morbi non lectus.,777
3/16/2022,5/26/2023,FALSE,863.15,vaisthorpell@tinypic.com,aroobottomll@nifty.com,Sony,Power,LCD,5,"Fusce posuere felis sed lacus. Morbi sem mauris, laoreet ut, rhoncus aliquet, pulvinar sed, nisl. Nunc rhoncus dui vel sem. Sed sagittis. Nam congue, risus semper porta volutpat, quam pede lobortis ligula, sit amet eleifend pede libero quis orci. Nullam molestie nibh in lectus. Pellentesque at nulla. Suspendisse potenti. Cras in purus eu magna vulputate luctus.",778
3/16/2022,7/21/2022,TRUE,458.83,mcoatlm@booking.com,nsalvidgelm@senate.gov,LG,Connectivity,LED,4,"Cum sociis natoque penatibus et magnis dis parturient montes, nascetur ridiculus mus. Vivamus vestibulum sagittis sapien. Cum sociis natoque penatibus et magnis dis parturient montes, nascetur ridiculus mus. Etiam vel augue. Vestibulum rutrum rutrum neque. Aenean auctor gravida sem. Praesent id massa id nisl venenatis lacinia. Aenean sit amet justo. Morbi ut odio. Cras mi pede, malesuada in, imperdiet et, commodo vulputate, justo.",779
3/16/2022,1/10/2023,FALSE,615.92,vcarelessln@drupal.org,etomkysln@bluehost.com,Sony,Sound,LED,5,"Donec vitae nisi. Nam ultrices, libero non mattis pulvinar, nulla pede ullamcorper augue, a suscipit nulla elit ac nulla. Sed vel enim sit amet nunc viverra dapibus. Nulla suscipit ligula in lacus. Curabitur at ipsum ac tellus semper interdum. Mauris ullamcorper purus sit amet nulla. Quisque arcu libero, rutrum ac, lobortis vel, dapibus at, diam. Nam tristique tortor eu pede.",780
3/16/2022,6/9/2023,TRUE,5.2,freffordlo@qq.com,cmittenlo@slate.com,LG,Other,LED,2,"Morbi quis tortor id nulla ultrices aliquet. Maecenas leo odio, condimentum id, luctus nec, molestie sed, justo. Pellentesque viverra pede ac diam. Cras pellentesque volutpat dui. Maecenas tristique, est et tempus semper, est quam pharetra magna, ac consequat metus sapien ut nunc. Vestibulum ante ipsum primis in faucibus orci luctus et ultrices posuere cubilia Curae; Mauris viverra diam vitae quam. Suspendisse potenti. Nullam porttitor lacus at turpis. Donec posuere metus vitae ipsum. Aliquam non mauris.",781
3/16/2022,6/10/2023,FALSE,776.92,dbulwardlp@quantcast.com,agriffinlp@over-blog.com,LG,Power,Plasma,3,"Proin leo odio, porttitor id, consequat in, consequat ut, nulla. Sed accumsan felis. Ut at dolor quis odio consequat varius. Integer ac leo. Pellentesque ultrices mattis odio. Donec vitae nisi. Nam ultrices, libero non mattis pulvinar, nulla pede ullamcorper augue, a suscipit nulla elit ac nulla. Sed vel enim sit amet nunc viverra dapibus. Nulla suscipit ligula in lacus. Curabitur at ipsum ac tellus semper interdum.",782
3/16/2022,3/8/2023,FALSE,16.24,mtamplinlq@ihg.com,nbamblq@dailymail.co.uk,Panasonic,Sound,LED,2,"Duis ac nibh. Fusce lacus purus, aliquet at, feugiat non, pretium quis, lectus. Suspendisse potenti. In eleifend quam a odio. In hac habitasse platea dictumst. Maecenas ut massa quis augue luctus tincidunt.",783
3/16/2022,8/27/2022,TRUE,190.47,mszwarclr@desdev.cn,mbiddwelllr@typepad.com,Samsung,Other,LED,4,"Duis consequat dui nec nisi volutpat eleifend. Donec ut dolor. Morbi vel lectus in quam fringilla rhoncus. Mauris enim leo, rhoncus sed, vestibulum sit amet, cursus id, turpis. Integer aliquet, massa id lobortis convallis, tortor risus dapibus augue, vel accumsan tellus nisi eu orci. Mauris lacinia sapien quis libero.",784
3/16/2022,8/22/2022,TRUE,511.72,mhoutenls@printfriendly.com,ddenkells@wiley.com,Toshiba,Power,Plasma,5,Donec dapibus.,785
3/16/2022,4/30/2023,TRUE,69.38,hrishbrooklt@miitbeian.gov.cn,tygoult@wufoo.com,LG,Other,Motherboard,0,"Quisque ut erat. Curabitur gravida nisi at nibh. In hac habitasse platea dictumst. Aliquam augue quam, sollicitudin vitae, consectetuer eget, rutrum at, lorem. Integer tincidunt ante vel ipsum. Praesent blandit lacinia erat. Vestibulum sed magna at nunc commodo placerat. Praesent blandit. Nam nulla.",786
3/16/2022,4/12/2023,FALSE,30.72,onealonlu@nyu.edu,blovellu@theatlantic.com,Toshiba,Display,LED,4,"Curabitur gravida nisi at nibh. In hac habitasse platea dictumst. Aliquam augue quam, sollicitudin vitae, consectetuer eget, rutrum at, lorem. Integer tincidunt ante vel ipsum. Praesent blandit lacinia erat. Vestibulum sed magna at nunc commodo placerat. Praesent blandit. Nam nulla. Integer pede justo, lacinia eget, tincidunt eget, tempus vel, pede. Morbi porttitor lorem id ligula.",787
3/16/2022,8/27/2022,FALSE,601.69,hreihmlv@blogspot.com,shazleylv@yahoo.com,Panasonic,Other,Plasma,5,"Nulla tellus. In sagittis dui vel nisl. Duis ac nibh. Fusce lacus purus, aliquet at, feugiat non, pretium quis, lectus.",788
3/16/2022,7/30/2022,FALSE,781.95,mspringlw@blogger.com,kbeardalllw@uol.com.br,Sony,Connectivity,LCD,3,"Nullam porttitor lacus at turpis. Donec posuere metus vitae ipsum. Aliquam non mauris. Morbi non lectus. Aliquam sit amet diam in magna bibendum imperdiet. Nullam orci pede, venenatis non, sodales sed, tincidunt eu, felis. Fusce posuere felis sed lacus. Morbi sem mauris, laoreet ut, rhoncus aliquet, pulvinar sed, nisl. Nunc rhoncus dui vel sem.",789
3/16/2022,8/24/2022,FALSE,177.23,spretorlx@archive.org,sspurmanlx@tripod.com,Toshiba,Sound,LCD,2,Vestibulum sed magna at nunc commodo placerat. Praesent blandit.,790
3/16/2022,10/25/2022,FALSE,232.45,kkerfootly@ftc.gov,csomerledly@xrea.com,Samsung,Sound,Motherboard,3,"Proin risus. Praesent lectus. Vestibulum quam sapien, varius ut, blandit non, interdum in, ante. Vestibulum ante ipsum primis in faucibus orci luctus et ultrices posuere cubilia Curae; Duis faucibus accumsan odio. Curabitur convallis. Duis consequat dui nec nisi volutpat eleifend. Donec ut dolor. Morbi vel lectus in quam fringilla rhoncus.",791
3/16/2022,2/11/2023,FALSE,314.48,agowngelz@mail.ru,waustonlz@theatlantic.com,Samsung,Display,Speaker,4,"Nam ultrices, libero non mattis pulvinar, nulla pede ullamcorper augue, a suscipit nulla elit ac nulla. Sed vel enim sit amet nunc viverra dapibus.",792
3/16/2022,3/20/2023,TRUE,914.88,pdigginsonm0@e-recht24.de,gfoylem0@chron.com,Samsung,Display,Motherboard,3,Morbi a ipsum.,793
3/16/2022,7/8/2022,TRUE,519.27,operssem1@tiny.cc,slacottem1@issuu.com,Panasonic,Connectivity,Motherboard,0,"Nullam molestie nibh in lectus. Pellentesque at nulla. Suspendisse potenti. Cras in purus eu magna vulputate luctus. Cum sociis natoque penatibus et magnis dis parturient montes, nascetur ridiculus mus.",794
3/16/2022,4/19/2023,FALSE,1.71,asutterbym2@fc2.com,rpasseym2@wp.com,Toshiba,Display,Speaker,3,"Nulla neque libero, convallis eget, eleifend luctus, ultricies eu, nibh. Quisque id justo sit amet sapien dignissim vestibulum. Vestibulum ante ipsum primis in faucibus orci luctus et ultrices posuere cubilia Curae; Nulla dapibus dolor vel est. Donec odio justo, sollicitudin ut, suscipit a, feugiat et, eros. Vestibulum ac est lacinia nisi venenatis tristique. Fusce congue, diam id ornare imperdiet, sapien urna pretium nisl, ut volutpat sapien arcu sed augue. Aliquam erat volutpat. In congue.",795
3/16/2022,5/22/2023,FALSE,882.38,ilistonem3@home.pl,chebbsm3@wunderground.com,LG,Other,LCD,2,"Nam dui. Proin leo odio, porttitor id, consequat in, consequat ut, nulla. Sed accumsan felis. Ut at dolor quis odio consequat varius.",796
3/16/2022,11/20/2022,FALSE,264.32,lgeldartm4@stumbleupon.com,bjaffram4@nhs.uk,Toshiba,Other,LED,4,Vestibulum ante ipsum primis in faucibus orci luctus et ultrices posuere cubilia Curae; Mauris viverra diam vitae quam. Suspendisse potenti. Nullam porttitor lacus at turpis.,797
3/16/2022,11/30/2022,TRUE,76.63,lpendletonm5@boston.com,ajanjusevicm5@who.int,Panasonic,Connectivity,LED,1,"Phasellus id sapien in sapien iaculis congue. Vivamus metus arcu, adipiscing molestie, hendrerit at, vulputate vitae, nisl. Aenean lectus. Pellentesque eget nunc. Donec quis orci eget orci vehicula condimentum. Curabitur in libero ut massa volutpat convallis.",798
3/16/2022,5/7/2023,TRUE,126.57,wossipenkom6@chron.com,sworshamm6@nhs.uk,Panasonic,Sound,LED,1,Vestibulum rutrum rutrum neque. Aenean auctor gravida sem. Praesent id massa id nisl venenatis lacinia.,799
3/16/2022,11/20/2022,FALSE,453.8,ebeebem7@topsy.com,plefrankm7@salon.com,Toshiba,Connectivity,Plasma,2,"Quisque porta volutpat erat. Quisque erat eros, viverra eget, congue eget, semper rutrum, nulla.",800
3/16/2022,2/2/2023,TRUE,348.09,mswanboroughm8@etsy.com,bastillm8@istockphoto.com,Toshiba,Sound,Plasma,2,"Sed accumsan felis. Ut at dolor quis odio consequat varius. Integer ac leo. Pellentesque ultrices mattis odio. Donec vitae nisi. Nam ultrices, libero non mattis pulvinar, nulla pede ullamcorper augue, a suscipit nulla elit ac nulla. Sed vel enim sit amet nunc viverra dapibus. Nulla suscipit ligula in lacus. Curabitur at ipsum ac tellus semper interdum.",801
3/16/2022,7/23/2022,FALSE,936.65,obaskeyfiedm9@gov.uk,amoretonm9@surveymonkey.com,Samsung,Display,LCD,4,"Aenean lectus. Pellentesque eget nunc. Donec quis orci eget orci vehicula condimentum. Curabitur in libero ut massa volutpat convallis. Morbi odio odio, elementum eu, interdum eu, tincidunt in, leo. Maecenas pulvinar lobortis est. Phasellus sit amet erat. Nulla tempus. Vivamus in felis eu sapien cursus vestibulum.",802
3/16/2022,3/30/2023,FALSE,951.11,promeroma@nasa.gov,qreussma@biglobe.ne.jp,LG,Connectivity,Speaker,4,Curabitur gravida nisi at nibh.,803
3/16/2022,11/2/2022,FALSE,446.76,omarzellimb@is.gd,lnajeramb@vimeo.com,Samsung,Other,Motherboard,1,"Praesent lectus. Vestibulum quam sapien, varius ut, blandit non, interdum in, ante. Vestibulum ante ipsum primis in faucibus orci luctus et ultrices posuere cubilia Curae; Duis faucibus accumsan odio. Curabitur convallis. Duis consequat dui nec nisi volutpat eleifend. Donec ut dolor. Morbi vel lectus in quam fringilla rhoncus. Mauris enim leo, rhoncus sed, vestibulum sit amet, cursus id, turpis. Integer aliquet, massa id lobortis convallis, tortor risus dapibus augue, vel accumsan tellus nisi eu orci.",804
3/16/2022,10/4/2022,TRUE,266.5,csissmc@blogger.com,iwyllismc@tmall.com,Sony,Display,Motherboard,3,"Praesent blandit lacinia erat. Vestibulum sed magna at nunc commodo placerat. Praesent blandit. Nam nulla. Integer pede justo, lacinia eget, tincidunt eget, tempus vel, pede. Morbi porttitor lorem id ligula. Suspendisse ornare consequat lectus. In est risus, auctor sed, tristique in, tempus sit amet, sem. Fusce consequat.",805
