3/1/2022,11/5/2022,FALSE,94.04,jplaceds@paypal.com,ktimbsds@jalbum.net,Sony,Display,Motherboard,2,Etiam pretium iaculis justo. In hac habitasse platea dictumst. Etiam faucibus cursus urna. Ut tellus. Nulla ut erat id mauris vulputate elementum. Nullam varius. Nulla facilisi. Cras non velit nec nisi vulputate nonummy. Maecenas tincidunt lacus at velit.,497
3/1/2022,10/19/2022,FALSE,891.04,lsapeydt@wix.com,slawtydt@mayoclinic.com,Panasonic,Sound,LCD,2,Ut tellus. Nulla ut erat id mauris vulputate elementum.,498
3/1/2022,3/19/2023,TRUE,438.06,rrollinsondu@sciencedirect.com,wkarchowskidu@vinaora.com,Sony,Power,Speaker,3,Maecenas ut massa quis augue luctus tincidunt. Nulla mollis molestie lorem. Quisque ut erat.,499
3/1/2022,1/27/2023,TRUE,232.41,fdubbindv@printfriendly.com,hleasondv@comsenz.com,Sony,Sound,Motherboard,4,"Mauris sit amet eros. Suspendisse accumsan tortor quis turpis. Sed ante. Vivamus tortor. Duis mattis egestas metus. Aenean fermentum. Donec ut mauris eget massa tempor convallis. Nulla neque libero, convallis eget, eleifend luctus, ultricies eu, nibh. Quisque id justo sit amet sapien dignissim vestibulum. Vestibulum ante ipsum primis in faucibus orci luctus et ultrices posuere cubilia Curae; Nulla dapibus dolor vel est.",500
3/1/2022,10/17/2022,FALSE,136.1,lcotterilldw@arstechnica.com,kramalhodw@pbs.org,Sony,Other,Plasma,1,Integer tincidunt ante vel ipsum. Praesent blandit lacinia erat.,501
3/1/2022,12/28/2022,FALSE,661.77,ablanketdx@baidu.com,mphilodx@creativecommons.org,Panasonic,Sound,Speaker,3,"Nullam sit amet turpis elementum ligula vehicula consequat. Morbi a ipsum. Integer a nibh. In quis justo. Maecenas rhoncus aliquam lacus. Morbi quis tortor id nulla ultrices aliquet. Maecenas leo odio, condimentum id, luctus nec, molestie sed, justo.",502
3/1/2022,4/23/2023,FALSE,874.75,mrichardetdy@weebly.com,ddailedy@oracle.com,Sony,Connectivity,Speaker,3,Nullam sit amet turpis elementum ligula vehicula consequat.,503
3/1/2022,7/12/2022,TRUE,204.46,csaggsdz@csmonitor.com,hbentedz@angelfire.com,Samsung,Power,Motherboard,1,"Maecenas tristique, est et tempus semper, est quam pharetra magna, ac consequat metus sapien ut nunc.",504
3/1/2022,7/3/2022,TRUE,534.6,mallcrofte0@businessinsider.com,zmyrkuse0@dailymotion.com,Panasonic,Connectivity,LCD,3,"Duis aliquam convallis nunc. Proin at turpis a pede posuere nonummy. Integer non velit. Donec diam neque, vestibulum eget, vulputate ut, ultrices vel, augue. Vestibulum ante ipsum primis in faucibus orci luctus et ultrices posuere cubilia Curae; Donec pharetra, magna vestibulum aliquet ultrices, erat tortor sollicitudin mi, sit amet lobortis sapien sapien non mi. Integer ac neque. Duis bibendum. Morbi non quam nec dui luctus rutrum.",505
3/1/2022,12/21/2022,TRUE,22.49,estude1@fastcompany.com,ajanowskie1@angelfire.com,Sony,Other,Plasma,1,"Cras in purus eu magna vulputate luctus. Cum sociis natoque penatibus et magnis dis parturient montes, nascetur ridiculus mus. Vivamus vestibulum sagittis sapien. Cum sociis natoque penatibus et magnis dis parturient montes, nascetur ridiculus mus. Etiam vel augue. Vestibulum rutrum rutrum neque. Aenean auctor gravida sem.",506
3/1/2022,7/11/2022,FALSE,823.81,nsatteforde2@sina.com.cn,mskentelberye2@army.mil,Samsung,Power,LED,5,"Nulla tellus. In sagittis dui vel nisl. Duis ac nibh. Fusce lacus purus, aliquet at, feugiat non, pretium quis, lectus. Suspendisse potenti. In eleifend quam a odio. In hac habitasse platea dictumst.",507
3/1/2022,11/23/2022,FALSE,803.59,hrameye3@jigsy.com,sgorriese3@unesco.org,LG,Power,Plasma,3,Maecenas ut massa quis augue luctus tincidunt. Nulla mollis molestie lorem. Quisque ut erat. Curabitur gravida nisi at nibh. In hac habitasse platea dictumst.,508
3/1/2022,9/19/2022,TRUE,22.64,iiacovuzzie4@ibm.com,lapflere4@walmart.com,Panasonic,Power,LCD,2,"Donec ut dolor. Morbi vel lectus in quam fringilla rhoncus. Mauris enim leo, rhoncus sed, vestibulum sit amet, cursus id, turpis. Integer aliquet, massa id lobortis convallis, tortor risus dapibus augue, vel accumsan tellus nisi eu orci. Mauris lacinia sapien quis libero. Nullam sit amet turpis elementum ligula vehicula consequat.",509
3/1/2022,10/9/2022,TRUE,878.68,mhughesdone5@tinypic.com,mbootye5@feedburner.com,LG,Sound,LCD,3,"Phasellus id sapien in sapien iaculis congue. Vivamus metus arcu, adipiscing molestie, hendrerit at, vulputate vitae, nisl. Aenean lectus. Pellentesque eget nunc. Donec quis orci eget orci vehicula condimentum. Curabitur in libero ut massa volutpat convallis.",510
3/1/2022,8/23/2022,FALSE,64.91,vnilgese6@patch.com,jrugierie6@so-net.ne.jp,Samsung,Sound,Plasma,0,"Vestibulum ante ipsum primis in faucibus orci luctus et ultrices posuere cubilia Curae; Donec pharetra, magna vestibulum aliquet ultrices, erat tortor sollicitudin mi, sit amet lobortis sapien sapien non mi. Integer ac neque. Duis bibendum. Morbi non quam nec dui luctus rutrum. Nulla tellus. In sagittis dui vel nisl. Duis ac nibh. Fusce lacus purus, aliquet at, feugiat non, pretium quis, lectus. Suspendisse potenti.",511
3/1/2022,8/3/2022,FALSE,971.88,kclyante7@elegantthemes.com,lbudgette7@msu.edu,Panasonic,Other,Plasma,1,"Nam ultrices, libero non mattis pulvinar, nulla pede ullamcorper augue, a suscipit nulla elit ac nulla. Sed vel enim sit amet nunc viverra dapibus. Nulla suscipit ligula in lacus. Curabitur at ipsum ac tellus semper interdum. Mauris ullamcorper purus sit amet nulla. Quisque arcu libero, rutrum ac, lobortis vel, dapibus at, diam.",512
3/1/2022,9/13/2022,TRUE,934.8,scresseye8@hud.gov,dninehame8@geocities.jp,LG,Connectivity,Speaker,0,"Suspendisse potenti. Cras in purus eu magna vulputate luctus. Cum sociis natoque penatibus et magnis dis parturient montes, nascetur ridiculus mus. Vivamus vestibulum sagittis sapien. Cum sociis natoque penatibus et magnis dis parturient montes, nascetur ridiculus mus. Etiam vel augue. Vestibulum rutrum rutrum neque. Aenean auctor gravida sem.",513
3/1/2022,9/12/2022,TRUE,373.08,wtrevarthene9@fema.gov,cburlingamee9@arizona.edu,Panasonic,Sound,Speaker,2,Vivamus in felis eu sapien cursus vestibulum.,514
3/1/2022,11/4/2022,TRUE,351.27,kmazzeyea@amazonaws.com,sgosbyea@networksolutions.com,LG,Sound,Plasma,2,"Pellentesque ultrices mattis odio. Donec vitae nisi. Nam ultrices, libero non mattis pulvinar, nulla pede ullamcorper augue, a suscipit nulla elit ac nulla. Sed vel enim sit amet nunc viverra dapibus.",515
3/1/2022,7/27/2022,TRUE,980.91,mpentonyeb@va.gov,hchattockeb@gizmodo.com,Samsung,Sound,Plasma,2,"Vestibulum ante ipsum primis in faucibus orci luctus et ultrices posuere cubilia Curae; Duis faucibus accumsan odio. Curabitur convallis. Duis consequat dui nec nisi volutpat eleifend. Donec ut dolor. Morbi vel lectus in quam fringilla rhoncus. Mauris enim leo, rhoncus sed, vestibulum sit amet, cursus id, turpis. Integer aliquet, massa id lobortis convallis, tortor risus dapibus augue, vel accumsan tellus nisi eu orci. Mauris lacinia sapien quis libero. Nullam sit amet turpis elementum ligula vehicula consequat.",516
3/11/2022,6/11/2023,FALSE,840.39,rgenckeec@youtube.com,dstaytec@wix.com,Panasonic,Other,LCD,1,Maecenas tincidunt lacus at velit. Vivamus vel nulla eget eros elementum pellentesque.,517
3/9/2022,9/18/2022,TRUE,221.82,cpresdeeed@skype.com,acaineyed@cdbaby.com,LG,Power,Plasma,4,"Cras non velit nec nisi vulputate nonummy. Maecenas tincidunt lacus at velit. Vivamus vel nulla eget eros elementum pellentesque. Quisque porta volutpat erat. Quisque erat eros, viverra eget, congue eget, semper rutrum, nulla.",518
3/11/2022,9/28/2022,FALSE,545.85,gblaymiresee@squidoo.com,gtryhornee@ucoz.com,Samsung,Other,Plasma,0,"Nullam molestie nibh in lectus. Pellentesque at nulla. Suspendisse potenti. Cras in purus eu magna vulputate luctus. Cum sociis natoque penatibus et magnis dis parturient montes, nascetur ridiculus mus. Vivamus vestibulum sagittis sapien. Cum sociis natoque penatibus et magnis dis parturient montes, nascetur ridiculus mus. Etiam vel augue.",519
3/10/2022,11/20/2022,TRUE,493.94,mannellef@mac.com,fpolycoteef@google.co.uk,LG,Display,Motherboard,4,Etiam pretium iaculis justo. In hac habitasse platea dictumst. Etiam faucibus cursus urna. Ut tellus. Nulla ut erat id mauris vulputate elementum. Nullam varius. Nulla facilisi. Cras non velit nec nisi vulputate nonummy. Maecenas tincidunt lacus at velit.,520
3/11/2022,9/18/2022,FALSE,714.42,mradcliffeeg@tinyurl.com,nmalkieeg@pinterest.com,Samsung,Display,Speaker,3,"Vivamus metus arcu, adipiscing molestie, hendrerit at, vulputate vitae, nisl. Aenean lectus. Pellentesque eget nunc. Donec quis orci eget orci vehicula condimentum. Curabitur in libero ut massa volutpat convallis.",521
3/10/2022,1/14/2023,TRUE,261.59,csoppitteh@bloglines.com,jchateleteh@php.net,Toshiba,Sound,Speaker,1,"Donec odio justo, sollicitudin ut, suscipit a, feugiat et, eros. Vestibulum ac est lacinia nisi venenatis tristique. Fusce congue, diam id ornare imperdiet, sapien urna pretium nisl, ut volutpat sapien arcu sed augue. Aliquam erat volutpat.",522
3/10/2022,11/25/2022,TRUE,953.93,dschreursei@bing.com,bdiglinei@github.com,Samsung,Power,LCD,1,"Vivamus tortor. Duis mattis egestas metus. Aenean fermentum. Donec ut mauris eget massa tempor convallis. Nulla neque libero, convallis eget, eleifend luctus, ultricies eu, nibh. Quisque id justo sit amet sapien dignissim vestibulum. Vestibulum ante ipsum primis in faucibus orci luctus et ultrices posuere cubilia Curae; Nulla dapibus dolor vel est. Donec odio justo, sollicitudin ut, suscipit a, feugiat et, eros. Vestibulum ac est lacinia nisi venenatis tristique.",523
3/10/2022,5/4/2023,TRUE,964.02,ncrennellej@vk.com,twhightej@tmall.com,Sony,Power,Plasma,4,Quisque ut erat. Curabitur gravida nisi at nibh. In hac habitasse platea dictumst.,524
3/11/2022,9/6/2022,FALSE,680.62,gwreifordek@macromedia.com,estillmannek@abc.net.au,Samsung,Connectivity,Speaker,1,Aliquam erat volutpat. In congue.,525
3/14/2022,3/10/2023,TRUE,886.01,cliefel@epa.gov,lkilbaneel@paginegialle.it,Samsung,Sound,Speaker,2,"Fusce consequat. Nulla nisl. Nunc nisl. Duis bibendum, felis sed interdum venenatis, turpis enim blandit mi, in porttitor pede justo eu massa. Donec dapibus. Duis at velit eu est congue elementum.",526
3/14/2022,3/10/2023,FALSE,156.83,lhellikesem@businessinsider.com,sbrouem@fotki.com,Toshiba,Other,Motherboard,2,"Nam dui. Proin leo odio, porttitor id, consequat in, consequat ut, nulla. Sed accumsan felis. Ut at dolor quis odio consequat varius. Integer ac leo. Pellentesque ultrices mattis odio.",527
3/14/2022,1/17/2023,TRUE,974.3,thubbarden@ed.gov,bheighoen@altervista.org,Panasonic,Display,LED,5,Sed accumsan felis. Ut at dolor quis odio consequat varius. Integer ac leo.,528
3/7/2022,9/9/2022,FALSE,858.29,cpietrasikeo@over-blog.com,breusseo@marketwatch.com,Samsung,Connectivity,LED,4,"Nam nulla. Integer pede justo, lacinia eget, tincidunt eget, tempus vel, pede. Morbi porttitor lorem id ligula. Suspendisse ornare consequat lectus. In est risus, auctor sed, tristique in, tempus sit amet, sem. Fusce consequat. Nulla nisl.",529
3/7/2022,9/23/2022,FALSE,506.31,bstobbartep@weather.com,streleaseep@harvard.edu,Toshiba,Connectivity,Speaker,3,Cras in purus eu magna vulputate luctus.,530
3/7/2022,10/1/2022,TRUE,792.89,bhindereq@last.fm,fsheermaneq@rambler.ru,Panasonic,Sound,Plasma,1,"Integer tincidunt ante vel ipsum. Praesent blandit lacinia erat. Vestibulum sed magna at nunc commodo placerat. Praesent blandit. Nam nulla. Integer pede justo, lacinia eget, tincidunt eget, tempus vel, pede.",531
3/7/2022,11/3/2022,FALSE,461.53,mdockreyer@google.es,ocruxer@addtoany.com,Toshiba,Other,LCD,4,Vestibulum ante ipsum primis in faucibus orci luctus et ultrices posuere cubilia Curae; Mauris viverra diam vitae quam. Suspendisse potenti. Nullam porttitor lacus at turpis. Donec posuere metus vitae ipsum. Aliquam non mauris. Morbi non lectus.,532
3/7/2022,11/18/2022,FALSE,549.24,kwaldrones@msu.edu,aansilles@facebook.com,Sony,Display,LCD,4,"Curabitur gravida nisi at nibh. In hac habitasse platea dictumst. Aliquam augue quam, sollicitudin vitae, consectetuer eget, rutrum at, lorem. Integer tincidunt ante vel ipsum. Praesent blandit lacinia erat. Vestibulum sed magna at nunc commodo placerat. Praesent blandit. Nam nulla. Integer pede justo, lacinia eget, tincidunt eget, tempus vel, pede.",533
3/7/2022,3/5/2023,FALSE,938.57,edrakeset@usda.gov,maleavyet@reverbnation.com,Sony,Power,LCD,3,"Lorem ipsum dolor sit amet, consectetuer adipiscing elit. Proin risus. Praesent lectus. Vestibulum quam sapien, varius ut, blandit non, interdum in, ante. Vestibulum ante ipsum primis in faucibus orci luctus et ultrices posuere cubilia Curae; Duis faucibus accumsan odio. Curabitur convallis. Duis consequat dui nec nisi volutpat eleifend. Donec ut dolor.",534
3/7/2022,12/6/2022,FALSE,198.04,mmethueneu@washington.edu,itheodoriseu@weather.com,Panasonic,Other,Plasma,2,"Quisque ut erat. Curabitur gravida nisi at nibh. In hac habitasse platea dictumst. Aliquam augue quam, sollicitudin vitae, consectetuer eget, rutrum at, lorem. Integer tincidunt ante vel ipsum. Praesent blandit lacinia erat. Vestibulum sed magna at nunc commodo placerat. Praesent blandit. Nam nulla.",535
3/7/2022,10/26/2022,TRUE,672.14,gizhakyev@hc360.com,msproulsev@google.nl,Toshiba,Display,Motherboard,4,"Donec ut dolor. Morbi vel lectus in quam fringilla rhoncus. Mauris enim leo, rhoncus sed, vestibulum sit amet, cursus id, turpis. Integer aliquet, massa id lobortis convallis, tortor risus dapibus augue, vel accumsan tellus nisi eu orci. Mauris lacinia sapien quis libero. Nullam sit amet turpis elementum ligula vehicula consequat. Morbi a ipsum. Integer a nibh.",536
3/7/2022,2/19/2023,TRUE,623.73,jgilpillanew@qq.com,mnormanvellew@archive.org,LG,Power,Motherboard,2,Nulla justo. Aliquam quis turpis eget elit sodales scelerisque.,537
3/7/2022,2/20/2023,TRUE,159.34,ematthiaeex@desdev.cn,bdinwoodieex@trellian.com,Toshiba,Display,Speaker,3,"Integer ac leo. Pellentesque ultrices mattis odio. Donec vitae nisi. Nam ultrices, libero non mattis pulvinar, nulla pede ullamcorper augue, a suscipit nulla elit ac nulla. Sed vel enim sit amet nunc viverra dapibus. Nulla suscipit ligula in lacus. Curabitur at ipsum ac tellus semper interdum.",538
3/7/2022,9/2/2022,TRUE,780.4,abyattey@pbs.org,lcasoley@squarespace.com,Panasonic,Sound,Speaker,4,Phasellus id sapien in sapien iaculis congue.,539
3/7/2022,10/17/2022,TRUE,499.58,gkindallez@gov.uk,jattewellez@youku.com,Sony,Display,LCD,0,"Vestibulum ante ipsum primis in faucibus orci luctus et ultrices posuere cubilia Curae; Nulla dapibus dolor vel est. Donec odio justo, sollicitudin ut, suscipit a, feugiat et, eros. Vestibulum ac est lacinia nisi venenatis tristique. Fusce congue, diam id ornare imperdiet, sapien urna pretium nisl, ut volutpat sapien arcu sed augue.",540
3/7/2022,11/11/2022,TRUE,720.67,kbrundellf0@multiply.com,sbulpittf0@ustream.tv,LG,Sound,Speaker,3,"Integer ac neque. Duis bibendum. Morbi non quam nec dui luctus rutrum. Nulla tellus. In sagittis dui vel nisl. Duis ac nibh. Fusce lacus purus, aliquet at, feugiat non, pretium quis, lectus.",541
3/7/2022,6/16/2023,TRUE,404.39,nbaptistf1@spotify.com,sgeldertf1@g.co,LG,Sound,LED,1,"Vestibulum sed magna at nunc commodo placerat. Praesent blandit. Nam nulla. Integer pede justo, lacinia eget, tincidunt eget, tempus vel, pede. Morbi porttitor lorem id ligula. Suspendisse ornare consequat lectus. In est risus, auctor sed, tristique in, tempus sit amet, sem. Fusce consequat.",542
3/7/2022,9/17/2022,FALSE,306.61,gkiesself2@gravatar.com,wtayloef2@over-blog.com,Samsung,Connectivity,Speaker,3,"In hac habitasse platea dictumst. Morbi vestibulum, velit id pretium iaculis, diam erat fermentum justo, nec condimentum neque sapien placerat ante. Nulla justo. Aliquam quis turpis eget elit sodales scelerisque. Mauris sit amet eros. Suspendisse accumsan tortor quis turpis. Sed ante.",543
3/7/2022,3/5/2023,TRUE,872.56,atabourinf3@purevolume.com,dgrishakovf3@wp.com,Panasonic,Connectivity,LED,4,"Nam congue, risus semper porta volutpat, quam pede lobortis ligula, sit amet eleifend pede libero quis orci.",544
3/7/2022,1/6/2023,FALSE,425.87,bfrankcombf4@chron.com,eholbarrowf4@skype.com,Sony,Connectivity,Motherboard,3,"Fusce posuere felis sed lacus. Morbi sem mauris, laoreet ut, rhoncus aliquet, pulvinar sed, nisl. Nunc rhoncus dui vel sem.",545
3/7/2022,4/22/2023,FALSE,882.81,asandellf5@liveinternet.ru,wrantoullf5@skyrock.com,Panasonic,Sound,Speaker,1,Suspendisse potenti. In eleifend quam a odio. In hac habitasse platea dictumst. Maecenas ut massa quis augue luctus tincidunt. Nulla mollis molestie lorem. Quisque ut erat. Curabitur gravida nisi at nibh. In hac habitasse platea dictumst.,546
3/7/2022,2/27/2023,TRUE,16.92,mbernardezf6@mail.ru,tpriddief6@boston.com,Samsung,Sound,LED,2,"Quisque id justo sit amet sapien dignissim vestibulum. Vestibulum ante ipsum primis in faucibus orci luctus et ultrices posuere cubilia Curae; Nulla dapibus dolor vel est. Donec odio justo, sollicitudin ut, suscipit a, feugiat et, eros. Vestibulum ac est lacinia nisi venenatis tristique. Fusce congue, diam id ornare imperdiet, sapien urna pretium nisl, ut volutpat sapien arcu sed augue. Aliquam erat volutpat.",547
3/7/2022,8/20/2022,FALSE,319.04,mskelhornf7@amazon.de,aanettsf7@opensource.org,Samsung,Display,LCD,4,"Fusce congue, diam id ornare imperdiet, sapien urna pretium nisl, ut volutpat sapien arcu sed augue. Aliquam erat volutpat. In congue. Etiam justo. Etiam pretium iaculis justo. In hac habitasse platea dictumst. Etiam faucibus cursus urna.",548
3/7/2022,7/12/2022,FALSE,252.19,kcastellaf8@tmall.com,mmahedyf8@geocities.com,Samsung,Sound,Speaker,4,"Donec ut dolor. Morbi vel lectus in quam fringilla rhoncus. Mauris enim leo, rhoncus sed, vestibulum sit amet, cursus id, turpis. Integer aliquet, massa id lobortis convallis, tortor risus dapibus augue, vel accumsan tellus nisi eu orci. Mauris lacinia sapien quis libero. Nullam sit amet turpis elementum ligula vehicula consequat. Morbi a ipsum. Integer a nibh. In quis justo.",549
3/7/2022,8/7/2022,FALSE,248.74,tmarvelleyf9@ucla.edu,lskeenef9@ebay.co.uk,LG,Sound,LCD,0,"Nam dui. Proin leo odio, porttitor id, consequat in, consequat ut, nulla. Sed accumsan felis. Ut at dolor quis odio consequat varius. Integer ac leo. Pellentesque ultrices mattis odio. Donec vitae nisi.",550
3/7/2022,3/25/2023,FALSE,914.59,lthorleyfa@thetimes.co.uk,tstifffa@independent.co.uk,Sony,Connectivity,Speaker,3,"Donec dapibus. Duis at velit eu est congue elementum. In hac habitasse platea dictumst. Morbi vestibulum, velit id pretium iaculis, diam erat fermentum justo, nec condimentum neque sapien placerat ante. Nulla justo.",551
3/7/2022,1/6/2023,TRUE,705.78,srosariofb@tinypic.com,redlestonefb@techcrunch.com,Samsung,Power,Motherboard,0,Sed accumsan felis. Ut at dolor quis odio consequat varius. Integer ac leo.,552
3/7/2022,9/15/2022,TRUE,950.31,lacklandfc@prlog.org,crickfordfc@adobe.com,Samsung,Other,LED,2,"Proin leo odio, porttitor id, consequat in, consequat ut, nulla. Sed accumsan felis. Ut at dolor quis odio consequat varius. Integer ac leo. Pellentesque ultrices mattis odio. Donec vitae nisi. Nam ultrices, libero non mattis pulvinar, nulla pede ullamcorper augue, a suscipit nulla elit ac nulla.",553
3/7/2022,12/18/2022,FALSE,811.86,hglencrashfd@alibaba.com,nkeaveneyfd@diigo.com,Sony,Power,LCD,4,Morbi non lectus. Aliquam sit amet diam in magna bibendum imperdiet.,554
3/7/2022,1/6/2023,FALSE,284.18,mbelseyfe@cafepress.com,sgirtfe@mozilla.org,Panasonic,Power,Speaker,4,"Morbi porttitor lorem id ligula. Suspendisse ornare consequat lectus. In est risus, auctor sed, tristique in, tempus sit amet, sem. Fusce consequat. Nulla nisl. Nunc nisl. Duis bibendum, felis sed interdum venenatis, turpis enim blandit mi, in porttitor pede justo eu massa. Donec dapibus. Duis at velit eu est congue elementum.",555
3/7/2022,9/30/2022,FALSE,169.79,jmacteggartff@miitbeian.gov.cn,afootff@java.com,Toshiba,Power,LCD,3,"Curabitur gravida nisi at nibh. In hac habitasse platea dictumst. Aliquam augue quam, sollicitudin vitae, consectetuer eget, rutrum at, lorem. Integer tincidunt ante vel ipsum.",556
3/7/2022,10/31/2022,FALSE,511.09,askillernfg@myspace.com,pkeightleyfg@dropbox.com,Sony,Display,Motherboard,4,"Duis mattis egestas metus. Aenean fermentum. Donec ut mauris eget massa tempor convallis. Nulla neque libero, convallis eget, eleifend luctus, ultricies eu, nibh. Quisque id justo sit amet sapien dignissim vestibulum. Vestibulum ante ipsum primis in faucibus orci luctus et ultrices posuere cubilia Curae; Nulla dapibus dolor vel est. Donec odio justo, sollicitudin ut, suscipit a, feugiat et, eros.",557
3/7/2022,2/14/2023,FALSE,371.07,scroftfh@sogou.com,msamworthfh@fc2.com,LG,Display,Motherboard,1,"Morbi ut odio. Cras mi pede, malesuada in, imperdiet et, commodo vulputate, justo. In blandit ultrices enim. Lorem ipsum dolor sit amet, consectetuer adipiscing elit. Proin interdum mauris non ligula pellentesque ultrices. Phasellus id sapien in sapien iaculis congue.",558
3/7/2022,11/2/2022,TRUE,4.45,manthonyfi@dell.com,tsammonsfi@alexa.com,Sony,Display,Speaker,3,"Morbi quis tortor id nulla ultrices aliquet. Maecenas leo odio, condimentum id, luctus nec, molestie sed, justo. Pellentesque viverra pede ac diam. Cras pellentesque volutpat dui. Maecenas tristique, est et tempus semper, est quam pharetra magna, ac consequat metus sapien ut nunc. Vestibulum ante ipsum primis in faucibus orci luctus et ultrices posuere cubilia Curae; Mauris viverra diam vitae quam.",559
3/7/2022,9/29/2022,FALSE,503.92,matherfj@businessweek.com,cchipmanfj@mashable.com,Samsung,Display,LED,4,"Vestibulum ante ipsum primis in faucibus orci luctus et ultrices posuere cubilia Curae; Duis faucibus accumsan odio. Curabitur convallis. Duis consequat dui nec nisi volutpat eleifend. Donec ut dolor. Morbi vel lectus in quam fringilla rhoncus. Mauris enim leo, rhoncus sed, vestibulum sit amet, cursus id, turpis. Integer aliquet, massa id lobortis convallis, tortor risus dapibus augue, vel accumsan tellus nisi eu orci. Mauris lacinia sapien quis libero. Nullam sit amet turpis elementum ligula vehicula consequat. Morbi a ipsum.",560
3/7/2022,4/27/2023,TRUE,148.83,grzehorfk@canalblog.com,yingmanfk@vistaprint.com,LG,Display,Motherboard,5,Nulla justo. Aliquam quis turpis eget elit sodales scelerisque. Mauris sit amet eros. Suspendisse accumsan tortor quis turpis. Sed ante.,561
3/7/2022,12/23/2022,FALSE,491.48,afendlenfl@ehow.com,gjoskafl@nbcnews.com,Sony,Connectivity,Plasma,0,"Morbi sem mauris, laoreet ut, rhoncus aliquet, pulvinar sed, nisl. Nunc rhoncus dui vel sem. Sed sagittis. Nam congue, risus semper porta volutpat, quam pede lobortis ligula, sit amet eleifend pede libero quis orci. Nullam molestie nibh in lectus. Pellentesque at nulla.",562
3/7/2022,7/16/2022,FALSE,862.72,eposerfm@stanford.edu,mriddlefm@studiopress.com,Sony,Other,LCD,3,"Nulla tellus. In sagittis dui vel nisl. Duis ac nibh. Fusce lacus purus, aliquet at, feugiat non, pretium quis, lectus. Suspendisse potenti.",563
3/7/2022,12/14/2022,FALSE,456.81,mcromblehomefn@artisteer.com,sgaitonefn@utexas.edu,LG,Other,Motherboard,3,"Nam dui. Proin leo odio, porttitor id, consequat in, consequat ut, nulla. Sed accumsan felis. Ut at dolor quis odio consequat varius. Integer ac leo.",564
3/7/2022,8/15/2022,FALSE,486.06,malphonsofo@vimeo.com,lwhettonfo@craigslist.org,Sony,Connectivity,Plasma,2,"Nunc nisl. Duis bibendum, felis sed interdum venenatis, turpis enim blandit mi, in porttitor pede justo eu massa. Donec dapibus. Duis at velit eu est congue elementum. In hac habitasse platea dictumst. Morbi vestibulum, velit id pretium iaculis, diam erat fermentum justo, nec condimentum neque sapien placerat ante. Nulla justo. Aliquam quis turpis eget elit sodales scelerisque. Mauris sit amet eros. Suspendisse accumsan tortor quis turpis.",565
3/7/2022,9/5/2022,FALSE,613.49,ktourryfp@issuu.com,ekindreadfp@google.com.br,Samsung,Sound,Motherboard,1,"Donec quis orci eget orci vehicula condimentum. Curabitur in libero ut massa volutpat convallis. Morbi odio odio, elementum eu, interdum eu, tincidunt in, leo. Maecenas pulvinar lobortis est. Phasellus sit amet erat. Nulla tempus. Vivamus in felis eu sapien cursus vestibulum. Proin eu mi. Nulla ac enim. In tempor, turpis nec euismod scelerisque, quam turpis adipiscing lorem, vitae mattis nibh ligula nec sem.",566
3/7/2022,5/19/2023,TRUE,120.42,nkinchingtonfq@comcast.net,gzealanderfq@jiathis.com,Sony,Other,LCD,2,"In tempor, turpis nec euismod scelerisque, quam turpis adipiscing lorem, vitae mattis nibh ligula nec sem. Duis aliquam convallis nunc. Proin at turpis a pede posuere nonummy. Integer non velit. Donec diam neque, vestibulum eget, vulputate ut, ultrices vel, augue.",567
3/7/2022,4/27/2023,TRUE,967.96,ctollidayfr@sbwire.com,skerfootfr@bbc.co.uk,Toshiba,Sound,Motherboard,4,"In quis justo. Maecenas rhoncus aliquam lacus. Morbi quis tortor id nulla ultrices aliquet. Maecenas leo odio, condimentum id, luctus nec, molestie sed, justo. Pellentesque viverra pede ac diam. Cras pellentesque volutpat dui. Maecenas tristique, est et tempus semper, est quam pharetra magna, ac consequat metus sapien ut nunc.",568
3/7/2022,11/2/2022,TRUE,897.22,akailfs@aol.com,bgovanfs@biglobe.ne.jp,LG,Display,LED,1,"Cras non velit nec nisi vulputate nonummy. Maecenas tincidunt lacus at velit. Vivamus vel nulla eget eros elementum pellentesque. Quisque porta volutpat erat. Quisque erat eros, viverra eget, congue eget, semper rutrum, nulla.",569
3/7/2022,8/3/2022,FALSE,298.89,ogoadeft@soup.io,sketleyft@wsj.com,Sony,Power,Plasma,4,Curabitur gravida nisi at nibh.,570
3/7/2022,8/8/2022,FALSE,821.45,mgayfu@nba.com,wargonttfu@guardian.co.uk,Samsung,Display,Motherboard,4,"Fusce congue, diam id ornare imperdiet, sapien urna pretium nisl, ut volutpat sapien arcu sed augue. Aliquam erat volutpat. In congue. Etiam justo. Etiam pretium iaculis justo. In hac habitasse platea dictumst.",571
